id,title,score_val,category,descript,reviews,keyword1,keyword2,keyword3
1630030343,아카사니,4.91,이자카야,비지니스로 좋은 연남동 맛집,"연남동 일대에서 가장 애정하는 이자카야 맛집 아카사니 입니다. 워낙 오픈 때 부터 다녔던지라 남다른 애정이 있는 공간이기도 한데 정말 여기 오너 셰프인 박혁 대표의 터치는 섬세하기가 이루 말할 길 없이 혀를 내두르게 된다. 뭐 워낙 자주 방문하는 사랑방이라 여기를 평가하라 하면 그건 아니 될 말이고..정말 너무 요리 잘하는 셰프의 손길이니 꼭 경험해 보시길 바라는 마음 뿐..🥹 분명 나처럼 사랑방으로 바로 저장할 터이니😁 / 훈련소 동기랑 저녁겸 술을 마시러감  일식을 한식으로 재해석했다는 재미와 맛이 있었음   김밥인줄 알앗는데 김으로 감싸인 참치  살면서 한두번 들어본 식재료(야채 잘 몰라서..)   도쿄여행에서 사온 닷사이랑 잘 어울림  술이 조금 부족해서 준마이도 시켰는데 닷사이가 더 맛잇긴 함   사장님이 친절하게 잘 설명해줌  머리스타일이 바버샾에서 하신것 같는데 잘 어울리심   하루에 2개밖에 판매하지 않는다는 아나고를 전화로 예약해서 맛잇게 먹었다   파스타도 맛잇엇고 빵도 맛잇엇다 / 안주가 깔끔해요. 회랑 익힌요리 둘 다 먹고싶어서 찾아보다 간건데 성공적! 숙성회는 사장님께서 하나하나 설명해주셔서 더 맛있게 먹을 수 있었어요. 회에는 사케니까 일단 사케 하나 드셔주시고(도쿠리 20,000원) 하이볼은 유자하이볼! 술맛 하나도 안나고 음료수같아서 술~술~ 넘어갑니당.  다 맛있는데 요리하는데가 바자리 바로 앞이라 음식냄새가 온몸에 베어요ㅠ 이건 좀 아쉬운데 페브리즈 뿌림 되니까ㅎㅎ 잘 먹고갑니다~! / 주문한 메뉴 모두 너무 맛있었습니다 오리스테이크 사진을 못찍었는데 파리에서 먹은 것 보다 맛있었어요🤎 당근퓨레, 고추지, 머스타드랑 오리의 조화가 환상적이었습니다 전복내장파스타는 다른 음식점에서는 비릴까봐 잘 시키지 않는 메뉴였는데 사장님 음식 솜씨를 확신하게 되는 메뉴였습니다 시끄럽지 않은 음악과 편안한 인테리어, 분위기를 완성시켜주는 인센스 등 사장님의 센스가 느껴져요 깨끗한 화장실까지 완벽했습니다 연남동에서 데이트 할 최적의 장소를 찾은 것 같아요 / 크리스마스에는 아카사니! 한마디로 정말 완벽한 하루였습니다 :)  이전에 왔을 때 맡김요리도 너무 좋았던 기억에 크리스마스 한정 맡김요리를 준비하셨다고 해서 여자친구와 왔습니다. 여자친구는 처음이었지만 먹는 내내 크리스마스 느낌이 물씬나는 플레이팅에 보는 즐거움, 육해진미로 다양한 맛의 행복감을 느끼며 지금도 어제 음식이 생각난다고 하네요ㅋㅋㅋ  음식이 나올때 음식에 대한 친절한 설명이 있어서 더 기억에 남으며, 여유로운 매장 분위기에 대화를 나누기 좋고, 음식은 물론 다양한 주류가 준비되어 있어서 모임장소로도 추천합니다!  내년 크리스마스가 벌써 기다려 집니다 :) / 연남동에 맛집이 정말 많지만 여러 번 방문하게 되는 곳은 잘 없는데 아카사니는 벌써 네번째 방문이에요! 제철 맞은 다양한 사시미랑 전복내장파스타, 토마토 스키야키에 마끼와 단호박 바스크 치케까지 한 입도 안남기고 둘이서 다먹었네요..ㅎㅎ 항상 모든 메뉴 친절하게 설명해주셔서 더 맛있게 먹고 옵니다 :) / 가격은 좀 비싸지만. 맛과 퀄리티가 참 좋네요. 기본 반찬이라도 한두개 있으면 좋겠네요. 분위기 좋아요 / 연남동 이자카야 아카사니에서 맛있게 먹고 리뷰 남겨요~처음 들어갔을때부터 깔끔한 인테리어에 사장님도 너무 친절하셔서 기분이 좋았어요~음식도 먹기 아까울 정도로 비주얼이 좋고 맛도 좋아서 나중에 신랑이랑 데이트할때도 와야겠다고 생각했어요ㅎㅎ다음에 또 다른 메뉴 먹으러 방문할께요~맛있게 잘 먹고 갑니다~~~👍😄 / 홍대에서 분위기 좋고 맛도 있는 이자카야 찾는다면 이제 아카사니 추천할려고요! 이자카야집인데도 가격이 합리적이고 무엇보다 안주 맛이 장난아닙니다... 사장님 요리솜씨가 👍 👍 평소에 접하기 힘든 한국 전통주도 다양하게 구비돼 있어서 좋았어요! 음식이 맛있다보니 술도 너무 달아서 시간가는줄 모르고 마셨네요 ㅎㅎ 맛있게 먹었습니다 다음에 또 방문할게요~! 🤗 / ",음식이 맛있어요,특별한 메뉴가 있어요,술이 다양해요
1063954725,수라간,4.66,한정식-일반,,"웨이팅이 하나도 아깝지 않은 진짜 한식 맛집 닭볶음탕 닭잡내없이 깔끔하고 부드러웠고 고등어구이는 겉바속촉 그 자체에요! 반찬도 빠짐없이 다 맛있어서 연남동에서 유일하게 재방문하고 싶은 곳- 더불어 직원분 너무너무 친절하셔서 더 기분좋게 먹고 왔어요 잘먹었습니당 / 줄서는 집은 다 이유가 있네요 ㅎㅎ  메인으로 주문한 뼈 없는 닭도리탕 강추(뼈 있고 없고 선택 가능해요) , 왕새우전도 손질새우 실하게 들어 있어 노릇노릇 바삭했어요.  어묵볶음, 고구마줄기 나물, 계란 사라다, 김치 기본찬 모두 맛있어 한번씩 리필 했어요.  식사 & 반주 모두 추천해요.  막걸리, 전통주, 소주, 맥주 주류도 다양했어요 / 양념게장 순살닭볶음탕 먹고왔는데 진짜맛있네요 1시간 웨이팅 가디린가치가있어요 ㅎ  #연남동맛집#연남동한식 자세한 내용은 블로그참고 https://m.blog.naver.com/nostalsokei7/223514527050 / 지인을 통해 알게 된 곳으로 집에서 엄마가 해주시는 정성스러운 맛이에요 ㅎㅎ 자극적이지도 않으면서 재료도 좋은 거 쓰시는것 같고 닭볶음탕이 정말 맛있어요.  가족들과 오기에도 좋은 장소 인것 같고  엄청 친절하세요~~~  젓가락 떨어뜨렀는데 바로 들으시고 젓가락 챙겨 주시더라고요 ㅎㅎ 편하게 맛있게 잘먹고 갑니다 / 연남동에 있는 수라간은 정갈하고 맛있는 한식맛집이에요 ~~ 복잡하고 젊은 거리에 수라간이 있어 깜놀했으나 역시 어느세대든지 한식은 좋아하는듯요 웨이팅이 겨속되어 맛집인증이더라구요 닭볶음탕은 울엄마맛 그대로 새우전은 비주얼이 최고였어요 맛도 최고이구요 ~~ 자주 갈께요 / 연남동 핫플 수라간 평일저녁은 웨이팅 필수라 캐치테이블 예약 완전 추천해요>,< 대기 예상시간보다 엄청 빠르게 들어갔어요!! 순살도 있어서 너무 좋고 다 닭다리살이라서 엄청 부들부들 맛나요 이곳의 시그니처 감자전도 진짜 예술이에요 ㅠㅠㅠ 음식도 깔끔하고 전체적으로 대만족합니다 / 연남동에서 한정식집 수준의 정갈하게 맛있는 음식을 맛볼 줄이야!!! 닭도리탕 살 완전 부드러워서 젓가락만 되면 결대로 찢어지고 입에서 살살녹아요! 양념게장이 신메뉴라고 해서 시켜봤는데, 이것도 계장 전문집처럼 맛잇어요 다음에는 다른 메뉴도 먹어 보러 가야겠어요!! / 방문할 때마다 웨이팅이 많아서 방문이 두려웠는데 이날은 웨이팅이 많이 없어서 드디어 오랜만에 먹었습니다😂 매장이 조금 작은 편이니 웨이팅은 꼭 필수‼️ 하지만 기다린만큼 맛이 황홀하니 기다림의 가치가 엄청난 곳입니둥🩷 매장 직원분들이 엄청 친절하시고 맛은 말해뭐해,,  반찬은 그때마다 조금 다른거같은데 반찬도 너무 맛있고 닭볶음탕이랑 감자전 시켜먹었는데 조합이 아주 훌륭하니 꼭 드시길 추천드립니다👍🏻👍🏻🩷 / 순살닭볶음탕과 감자채전 먹었습니다 전반적으로 자극적이지않은 담백한 맛이였고 감자채전 첫 입이 엄청 맛있었어요 아쉬운건 가게내부가 좁고 감자채전이 잘려서 나왔다면 더 먹기좋지않았을까 하는... / 순살닭볶음탕~단짠의 강렬함이 아닌데도 순살에 간이 쏘~옥^^ 깔끔하면서 간이 딱 맞아요 국물도 자극적이지 않으면서 볶음탕의 본연의 맛은 그대로!! 왕새우부추전~ 이름그대로 생 왕새우가 한가득ㅋ 밀가루나 부침가루를 아주 소량으로 사용해 부추전 본연의 맛을 살려 좋았어요 (다른 전집 보면 부침가루 많이 파삭하게 튀기듯 입에는 달고 건강에는 해로운 ㅋ 그런 맛이 아님) 참!!! 밑반찬 깔끔하고 맛있어서 리필 했어요 ㅋ #홍대맛집 #연남동맛집 #수라간연남동 #홍대데이트",음식이 맛있어요,친절해요,재료가 신선해요
1698144185,소점,4.81,일식당,,"히로시마풍 오코노미야끼와 타코야끼로 두명이서 아주 든든히 잘 먹었어요. 감자튀김과 소시지 추가로 주셨구요. 공손하신 사장님 진짜 재료 듬뿍 넣어주셨어요. 하이볼 완전 맛집이구요. 월요일은 12시 오픈이라시니 참고하세욤👍🏻 / 동생이 오랫만에 놀러와서 맛있게 먹었어요. 오픈런했는데, 5분만 늦었어도 기다릴뻔 했어요. 동네 유명한 오코노미야키 맛집인데, 친절한 사장님 덕분에 맛있게 먹고 왔습니다.^^후식으로 다코야키 꼭 드세요! 진짜 맛있어요. 강추! / 고즈넉하게 내리찌는 햇빛 아래를 걷다가 단숨에 낯선 나라 일본으로 데려다 주는 것만 같은 [소점]  🍳 사장님께서 주문하는 방법, 계란 후라이 굽기 정도, 음식을 먹거나 소스 뿌리는 방법 등 무척 섬세한 케어링을 해주신다. 아무래도 작고 아늑한 규모이기에 가능한 지점으로 보인다.  🍟 오코노미야키는 2인용으로 구성되어 있으나, 1인 방문시 양과 가격을 조정해주신다. 서비스로 소세지와 감자튀김도 올려주셨다!  🐙 혼자 온 손님들을 배려하여 식사 중에는 최대한 댜화를 자제하거나 조용히 대화하도록 되어 있다. 가게 내부에는 사장님의 취향이 듬뿍 담긴 인테리어를 살펴보는 재미가 쏠쏠하다. / 죽기 전에 먹고 싶은 마지막 음식 1위👍 진짜 너무 맛있고 기다림이 하나도 아깝지 않은 맛!!!!! 가격도 저렴하고 친절함도 과분할정도고.. 하... 인생 최고의 맛집ㅠㅠ 메뉴는 평범한데 맛이 절대로 평범하지 않고 눈앞에서 만들어주시는 음식으로 시각적으로도 만족했으며, 그 재료들이 하나하나 입에서 맴돌때 정말 최고로 행복했어요❤️ 몇시간씩 기다리고 먹어도 충분히 만족할 맛입니다 흐그흐그흑ㄱ구ㅜㅜㅜㅜ / 히로시마풍의 오코노미야키. 타코야키 6알. 야키소바.  오코노미야키의 양많은 풍성함. 타코야키의 색다른 발견. 빵와 야키소바. 좌석이 많지 않은 주인이 다하는 일인 식당. 성산동에 가까운 연남동. 작지만 알찬 식당 / 👏 한시간 기다려도 괜찮은 곳~ 자주 오고 싶은데… / 평일 오후 애매한 시간에 방문해서 웨이팅 길지 않았구요, 사장님 정말 친절하십니다! 음식맛은 말하기 입아플 정도☺️ 두 명이서 오코노미야끼2판 야끼소바1개 타코야끼6알 클리어했어요!! / 전메뉴가 맛있는 믿고먹는 소점 ..! 사장님께선 언제나 처럼 친절하시고, 오늘은 유독 타코야키가 맛있는 날이었어요 ! 💛 연남동의 작은일본 ✌️ / 금요일 5시쯤 갔는데 대기가 없어서 바로 들어사서 먹었어요! 히로시마풍 오코노미야키와 야키소바 먹었는데 너무 맛있어요!! 역시는 역시👍🏻 저는 한번도 더 주문한 적이 없는데 옆 테이블 보니 오징어, 소세지, 계란 등 토핑을 더 주문헤서 먹더라구요!! 부족하신 분들은 더 주문해서 먹어도 될 것 같아요! 포장해서 집에와서 먹어도 좋을거같아요! 잘먹었습니다!! / 동네 맛집인데, 지인분과 맛있게 먹고 왔어요. 히로시마스타일 오꼬노미야키 대만족! 다코야끼도 추가 주문해서 먹었는데, 현지보다 훨씬 맛있어요. 쇼가가 들어가지 않아서 좋았어요. 재방문해서 다른 메뉴도 먹어보려고 해요. 인생 맛집! 사장님도 친절하시고 일본 노포식당 분위기 넘 좋아요.",음식이 맛있어요,친절해요,특별한 메뉴가 있어요
1690354455,갓잇 연남점,4.55,"멕시코,남미음식",농림축산식품부 제공 안심식당,"갓잇 드디어 방문해요! 타코 좋아하는 사람이라면 꼭 오세요!  일단 선택지가 많아서 메뉴 고르는데 좀 애먹었어요 ㅎㅎ 저는 포크,새우 조합으로 시켰는데 든든하고 맛있더라구요! 주말은 웨이팅 있는데 10분안에 바로 입장했어요 바쁘실텐데 직원분도 친절하고 맛있는 식사 했습니다!👍🏻 / B세트 새우타코로 주문했어요.  세트메뉴가 잘 돼있어서 주문하기 편했고 양도 적당했어요! 새우타코 한입 크게 먹고 맛있어서 기대감 상승.. 파히타 역시 또띠아에 이것저것 조합해서 소스 왕창 뿌려먹으면 너어어무 맛있어요. 맛있다는 말 말고 뭐라고 설명해야 할지 모르겠네 유명한 이유가 있슴다 친절하고 손 닦는 곳도 잘 돼있어 더 좋았어요. / 타코 맛집이라고 듣고 또 듣던 곳 마침내 방문! 아, 이래사 갓잇하는구나, 싶은 맛. 파히타 B세트를 먹었는데 둘이 다 먹지 못할 정도로 양은 꽤 많다. 그리고 자극적이지 않아 계속 들어간다 ㅎㅎ  멕시칸 음식에 익숙치 않은 사람들도 무난하게 먹을 수 있는 맛있는 타코 맛집! 지인이 네이버 예약해서 방문했는데 설탕 뿌린 또띠아칩을 받아왔는데 생각보다 맛있음!! ㅎㅎ / 짜지 않고 자극적이지도 않은데 이렇게 맛있을 수 있나용...?! 소식좌커플 싹싹긁어서 다 먹고 왔어요~! 고기도 야들야들 맛있고 새우가 진짜 포인트에 또띠아피도 쫀득하니 맛있어요~! 3가지 소스 모두 맛있고 1:1:1비율로 먹으니 개인적으로 맛있었어요~! 그리고 감튀는 얇은 맘터st이더라구용!! 덜 짜고 넘넘 맛있게 잘 먹었더용~! / 🌮패밀리세트(4인용)으로 주문했어요! 🌮3번째 방문할 만큼 맛집!! 🌮솔직히 가성비는 모르겠지만 진짜 너무 맛있었었어요!  🌮2년전에 방문했을때는 30분이상 기다리고 먹어서 미리 예약하고 갔어요! 5시 20분에 갔는데! 널널하도라고요! 평일 금요일이었어요😊 직원분 한분이 너무 친절하게 설명해주시고 이벤트도 참여하실 수 있게 넘 잘알려주셨어요!! 너무 나이스하셔서 친구들리랑 즐겁고 맛있고 기분좋게 먹을 수 있었어요!!  🌮또띠아? 새우 돼지고기 닭 고를 수 있는데 갠적으로 새우랑 닭이 제 스타일이었어요! 친구들이 새우를 못먹어서 ㅎㅎㅎ 이번에 닭이랑 새우만 골랐다는 ㅎㅎ  이런분들! 🌮타코를 먹어본적이 없는데 맛있게 먹고 싶다! 🌮분위기 좋은 곳에소 먹고싶다! / 분위기 좋고 맛있어요 평일저녁에 먹다보니 만석 / 가성비좋은 세트메뉴 공간도 쾌적하고 음식도 다 맛있었어요! 특히 엔칠라다 추천입니다 / 아내와 함께 평일 점심먹으러갔어요!  오랜만애 타코나 멕시코음식 먹으러 갔는데 맛있엇네요~ 다만 전에는 소스 같은건 더 달라면 주셨는데 이젠 추가요금이있네요 ㅠ 그래도 잘먹었어요 / 맛있고 다른지점보다 넓고 조용하고 다좋ㅇㅏ요 / 야채도 너무 신선하고 남미식 타코를 가성비 좋게 먹을 수 있어서 좋아요ㅎㅎ 직원분들도 너무 친절해서 다음에 또 방문할 것 같아요",음식이 맛있어요,재료가 신선해요,친절해요
1093809527,우미집1947 연남본점,4.99,한식,농림축산식품부 제공 안심식당,"할아버지가 갑자기 티비 보시더니 꼬리곰탕이 먹고 싶다고 하셔서 2년전쯤 회사때문에 연남동에서 자취했을 두어번? 맛있게 먹은 기억이 있어 엄마와 아빠 할아버지 모시고 다시 방문했습니다. 😝 그사이 이전하셨는데 분위기와 인테리어 여전히 멋있어 1차 놀라고(입구가 완전 미쳤어요👍 숲길 들어가는 기분?) 할아버지랑 엄마 아빠가 너무 잘드셔서 정말 좋았아요!!   여전히 너무 담백하고 맛있었습니다 😋😋 정신없이 먹어서 빈 그릇만 찍었어요 (깍두기 정말 맛있어요😭)  특히 할아버지가 너무 잘 드시니 엄마 아빠도 좋아하시고 평소 적립같은건 모르시는 아빠가 꼬리곰탕 중 최고라고 계산할때 또 올 것 같다며 적립까지 하시는걸 보고 뿌듯했습니다 😝 여전하신 사장님 또 올께요~~~ / 지극히 개인적이 맛평가입니다.  네이버에서 평은 압도적으로 1등이라 가봤습니다. 모던+전통적이고 심플한 인테리어. 사장님 진짜 친절하심. 첨에 음식나오면 음. 가격에 비해 좀 부실한데 이런 느낌입니다. 제 생각에는 저 뚝배기 모양때문인듯. 기존 리뷰들이 맛평가가 넘 좋은데 제 입맛에는 깊은 맛은 느끼지 못했습니다. 곰탕 나올때 가장 뜨거울때 첫 숫가락 먹으면 그래 이거지 하는 느낌?이 없어서 인거 같습니다. 전체적으로 고기나 국물맛은 괜찮습니다. 인별맛집으로 한번 가볼만은 한거 같습니다. / 와웅🥹 비오는날 우연히 찾은 맛집..!!! 아니말이죠.. 분위기도 너무 좋고  음식도 너무 정갈하고 맛있는데 사장님께서 하나부터 열까지 신경쓰신 느낌이 팍팍 ..🫶 메인디쉬도 밑반찬도 그리고 곁들이는 한잔의 전통주도.. 너무 사랑스런 조합이라❣️정말 사랑에 빠지고 나와버렸습니다!   여기 꼭 가보세요!!  좋은 사람들이랑 좋은 추억남기기 좋은곳 아주 추천이요💛  곧 자세한 후기는 블로그에 남길께용😉 / 두번째 방문이지만 리뷰는 처음 써봐요!  일단 연남동 저의 최애맛집 1등입니다..  도가니탕 우족이 소울푸드시면 무조건 오셔야 합니다..  너무 깔끔하고 맛이 미쳤어요..!  그리고 직원분들도 너무 친절하시고 사장님도 천사십니다.. 너무 친절하세요 ㅠㅠ  우족무침은 안먹어본 사람이 없었으면 좋겠습니다..  최고의 홍대연남 한식집입니다!!! / 연남동 꼬리찜 맛집입니다. 우족초무침도 맛있어요. / 친구 추천으로 와봤는데 분위기도 너무 좋고 간도 적당히 세서 너무 맛있었습니다🙏🏻 직원 분들도 너무 친절하셔서 힐링 그 자체였습니다! / 담백하고 시원한 국물맛이 좋아요! 맛있게 잘 먹었습니다. 자주 올것 같아요! / 소꼬리 갈비찜이랑 소꼬리찜 너무 맛있어요! 매장 분위기랑 음악이 조용해서 좋았어요. 또 올게요! / 역대급 친절 서비스 여기보다 친절한 서비스 본적이 없습니다. 재방분 의사 있으며 데이트, 친구 모임 장소 추천등 너무 좋아요. 음식도.맛있습니다. 마늘밥 맛있고, 고기도 맛나요. 뼈때문에 먹기가 조금 불편하기는 하지만 그래도 다시가고 싶은 맛집입니다 / 간간한 국물에 고기가 부드러워요 깍두기 맛있어요",음식이 맛있어요,친절해요,인테리어가 멋져요
1902874356,제스티살룬 연남,4.57,햄버거,연남 제스티살룬 이영자가 극찬한 새우버거 맛집,"바로 튀겨주셔서 진짜 따끈하고 너무 맛있어요!!!!! 소스도 진짜 고소하고 매콤하고 미쳤네요👍🏻👍🏻👍🏻 무조건 재방문 각입니다요!!! 갈릭 프라이도 강추예요!!! / 점심시간 딱 맞춰 방문했는데 단체손님이 좀 계셨어요..! 그래도 음식도 오래 안 기다리고 나오고, 기대했는데도 기대만큼 맛있었어요. 저는 느끼한 미국맛을 좋아해서 치즈 프라이도 너무 맛있게 먹었어요 :) / 성수는 너무 멀어서 연남점으로 방문했는데 인테리어도 독특해서 너무 예쁘고 쾌적해요!  와사비 양도 정할수있고 맛도있어서 좋아요♡♡ 점심시간피해서 조금일찍왔더니 대기없이 바로들어왔고 좌석수도 꽤있는편이라 여럿이 오기도괜찮고 창가자리는 혼자오기도 좋을것같아요! / 제스티살룬 성수 방문 후 연남점은 첫 방문인데 여기두 진짜 맛있어요😋👍 가게 분위기는 다르지만 색다르게 좋네요!! 역시 새우버거와 갈릭버거는 진쨔🥲🩷 가까우니 또 먹으러 또 올 예정입니당!! 가까워서 넘 좋아요🍀 / 주말 점심이랑 저녁은 피크시간대만 아니면 대기없이 바로 주문할 수 있는 곳! 특별한 메뉴들이 있어서 가끔 먹기 좋아용. 매장도 생각보다 넓어서 웨이팅 있어도 금방 먹을 수 있을 듯 싶습니다 ㅎㅎ트러플루꼴라가 별미메뉴이니 꼭 드셔보세요! / 매장도 너무 예쁘고 버거랑 갈릭 치즈 프라이 미쳤어요ㅜㅠ 주문 하다 해프닝이 있었는데 그냥 바로 환불해주시고 다시 버거를 만들어주셔서 감사했어요!!!! 버거가 작아보이지만 배도 부르고 너무 맛있어요!!!! 갈릭소스ㅜㅠ♡♡사랑♡♡♡ 매장 내부도 쾌적하고 넓고 좋아요!! 느낌 있는 음악들도 틀어놔주셨어요!! 조금 크긴 한데 얘기 못 할 정도는 아니에요!!! 담에도 또 오려구요♡♡♡ / 3번째 재방문!!! 새우버거 짱짱맛이라 홍대올때마다 오고있숩니당👍🏻 애매한 4:30에왔더니 대기도업이 바로들어옴!!! 새우버거패티 두꺼워서 완전짱🍔 / 혼밥하러 왔는데 음식도 맛있구 힙한 분위기라  좋았습니다-!  이영자 님 맛집 인정~ / 탱글탱글새우버거 역시 맛있네요. 남편은 베스트라 되어있는 제스티갈릭 주문했는데 맛있다고 잘 먹었구요. 한입 먹어봤는데 맛있긴 했지만 저는 역시 새우ㅎㅎㅎ감튀도 주문했는데 기대보단 평범했어요. 재미있는 매장인테리어도 그렇고 맛있는 한끼였어요👍 / 원탑 새우버거 제스티살룬…💕 연남 지점은 서울숲 지점보다 대기가 적고 쾌적해서 좋아요!  와사비 양도 자기가 선택할 수 있고 주문하면 바로 만들어주셔서 가끔 포장해서 가족들이랑 같이 먹습니다 ㅎㅎ 가격은 좀 있지만 그만큼 가치있는 맛이에요🤤",음식이 맛있어요,인테리어가 멋져요,특별한 메뉴가 있어요
