id,title,score_val,category,descript,reviews,keyword1,keyword2,keyword3
1198311937,버우드,,브런치,,"뇨끼, 베니딕트, 쵸리쵸파스타 먹었는데 겁나맛나요 베네딕트or 어떤선호하는 조합먹는거 좋을듯 음료도 아메 마싯고 케일쥬스도 대박! 무엇보다 친절하심 ㅎ / 꺅 연남동 브런치 최애를 찾은것 같아요!!~! 연남동에 카페 정말 많잖아요? 첫방문 만으로 버우드는 연남 브런치 탑3라고 혼자 정했습니당😝 단호박뇨끼, 새우에그베네딕트를 주문했어용! 단호박뇨끼는 진하고 꾸덕한 단호박크림에 바질오일을 둘러 함께 먹는 건데요. 바질하고 단호박 조합이 이렇게 좋은지 몰랐어요👍 달달한 단호박과 바질의 향이 미쳤습니당.. 전 이거 먹으러 버우드 또 올것같아요❤️ 새우에그베네딕트는 익숙하면서 맛있어요! 사이드로 나오는 구운 버섯도 맛있구 사워도우 위에 올라간 소스가 맛있습니다ㅠㅠ  주말에 방문해서 웨이팅이 있었구 주방이 협소해서 음식이 나오는데 시간이 조금 걸린 것같아요. 그치만 단호박뇨끼가 기다리느라 지친마음을 달래주고 음식 데코까지 완벽해서 그냥 재방문하고 싶은 마음뿐이에요 강추‼️ / 분위기도 괜찮고 대기없이 들어갈 수 있어서 좋았습니당! 음식 맛도 좋았어서 추천입니당😆 / 브런치 좋아하는 초훈커플이 완전히 만족한 에그베네딕트 맛집!! 파스타까지 정말 완벽하더라구요!! 연어가 정말 부드럽고 플레이팅이 너무 예뻐서 기분 좋았던 곳👍🏻 / 파스타 넘 먹고싶어서 찾다가 발견한 곳 인데 진짜 너무 맛있었어요! 문어오일파스타 간이 쎈데 괜찮은지 여쭤봐주셨었는데 전 딱 좋았어요!✨ 문어 하나도 안질기고 부드럽고 새우 에그 베네딕트는 꼭 드셔보세요 !!!강추!!! 빵 굽기 겉바속촉 미쳤고 노른자에 아보카도에 오동통한 새우 같이 먹으니 이거 완전 도른자예요,,ㅠㅠ 우연히 맛집 찾아 너무 신나고 좋은 시간 보냈어요 직원분들도 굉장히 친절하시고 인테리어도 이뻐용!감사히 잘 먹었숩미다!!  아!!자몽에이드도 맛있어욥👏👏🥹🫶🏻 / 연남동브런치맛집 버우드 <- 짱맛있습니다,, 너무 잘 먹고 왔습니다 !! 연어 에그 베네딕트와 단호박뇨끼 그리고 케일시금치사과 주스 먹었는데 눈으로 맛보고 입으로 맛보고 즐거움 파티였어요 !! ㅠㅠ  연어는 훈제연어라 향이 좋았고 수란이 특히 부드럽고 고소했어요 ,, 식용 꽃으로 장식되어서 넘 예쁘고 전반적으로 대만족 !  단호박 뇨끼 소스 완전 담백하고 뇨끼가 은은하게 쫀득? 한게 느껴져서 취향저격이에요.. 요런 요리 브런치 오랜만에 먹어서 기분 최상이네요 잘 먹고 갑미다 !!! 홍대브런치맛집 버우드 추천 ! / 맛은 괜찮아요 가격대비 양은 적고 가격대비론 그냥 저냥 / 브런치 먹으러 친구랑 방문해서 프렌치토스트랑 연어베네딕트 주문했는데 먹기 아까울정도로 너무 이뻐요😍😍 프렌치토스트도 맛있는데 연어베네딕트가!! 진짜 비주얼도 예쁘고 너무 맛있어요!!❤️ 홍대 브런치 맛집인듯!! / 연남동 분위기 좋고 브런치 맛있는 연남동브런치 맛집 문어오일파스타 플레이팅도 예쁘고 문어도 부드러워서 오일파스타와 잘 어울려요 웨이팅맛집이라 손님이 많아서 음식나오기까지 좀 기다렸지만 맛이 좋았음 카페라떼 파스타 다 먹을때까지 라떼모양이 그대로  혼밥 브런치 연남동에서 즐겼음 연남동데이트 추천 / 리코타치즈 샐러드랑 문어 파스타가 정말 맛있어요. 쥬스도 바로 착즙해서 주시고, 여럿이 갔는데 다들 만족하고 왔네요.😍",음식이 맛있어요,재료가 신선해요,친절해요
36667236,장농속,,"맥주,호프",연남동 한옥에서 즐기는 수제 맥주,"토마토 브루스게타+ 오이진토닉  진토닉 맛이 너무 약하나 분위기는 좋음:) / 분위기가 좋아요 / 좋아요 / 아기자기한 분위기라 데이트하기 좋다. 맥주 종류가 다양하지는 않다. 기본 라거가 없다ㅠㅠ 조지아치즈피자는 무난맛있 / 늦은 시간이라 라스트 오더 마감 한 곳들이 많아서 주변 둘러보다가 문 열려 있길래 들어갔는데 메뉴 설명이 맛있을 것 같아서 저걸로 주문 했어요. 근데 웬걸.... 너무 맛있어서 이거 먹으러 또 가려구요...! 그리고 제가 술찐이라 생에 처음 하이볼을 먹어봤는데 생라임을 따로줘서 짜 넣었는데 상큼하고 달달하고 맛있었어요. 저 메뉴는 토마토 부르스게타 인데 제발 저거 꼭 드세요.....!! 가격도 착해요..... 에이드도 있어서 저처럼 술찐이들이 가도 먹을 것들이 많아서 좋았어요. 저도 술은 잘 못 하지만 나중에 저것만 먹으러 가려고요.ㅎㅎㅎ 정말 잘 먹었습니다! / Been here 3 years ago for the first time and now again~  Cozy mood (maybe even a little TOO warm 🥵😉) and nice music + good wine 🍷 didn't try the cocktails and for food I can only recommend the Bruschetta, but for second or third round after dinner it's perfect 😍 / 다른 분들은 피맥을 주로 드시던데 피자 비주얼도 엄청났어요… 배가 어느정도 부른 상태로 갔는데 정말 잘 먹었습니다. 메뉴가 맛나고 맥주 상태도 신선했어요! 사장님께서 센스있게 음식 준비해주시고 다음에 또 갈 의향 있습니다!! / 연남동에서 정말 애정하는 맥주집!  간맥으로 먹기 딱인 장롱속은  한옥을 개조하여 만들어서  특유의 분위기가 굿굿!  날씨가 선선할때난 테라스에서 먹우면 완전 유럽 그자체 ㅋㅋㅋㅋ   술한잔 마시고 2차로 어디갈까!? 하거나 데이트 장소를 찾거나 아니면 간맥집을 찾으신다면 연남동 장롱속!!!으로 / 눈이 펑펑 내려서 급하게 찾아서 간 곳인데 분위기도 넘 아늑하고 음식도 맛있어서 넘 좋았어요🫶🏻 카차프리 첨 먹어보는 피잔데 완전 강추합니다 후후 나중에 또 방문하고 싶네요🥰 / 배불러서 가벼운 안주랑 하이볼,맥주 맛있게 먹었어요!! 소주는 없습니다😭",음식이 맛있어요,친절해요,대화하기 좋아요
1556209064,플렘므,4.79,"카페,디저트",,"수플레 팬케이크 그 중에 크림브륄레 꼭 드세요 진짜 너무 맛있습니다 부들 촉촉 커스터드크림이 진짜 굿 커피도 맛있어요 아아는 산미가 약간 있는 커피고요 콜드브루는 첫맛에 약간 카카오맛이 나요 굿 마르코폴로도 차가 진짜 너무 맛있어요 향은 초코향이 약간 나는데 맛은 꽃차 느낌도 나는게 음료는 마르코폴로 콜드브루 추천합니다😍😍😍 / 크림 솔티 카라멜 너무 맛있어요! 크림 직접 다 만드셔서 그런가 정말 맛있었습니다. 원두도 좋은거 쓰시는거 같아요. 시그니처 메뉴인 수플레도 나오자마자 흡입했습니다. 크림을 정말 많이 주시는데 다 먹어도 끝까지 느끼하지 않게 먹을 수 있었어요! 메뉴들이 다 퀄리티가 높아서 비싸다고 느껴지지 않았습니다. 연남동 간다면 꼭 한번 가보시길 강추합니다◡̈ / 크림 브륄레 수플레 다른곳에서 먹어보지 못한 달달한 수플레에요~  과일도 싱싱하니 맛있네요! 과일수플레 맛집은 여기가 최고! 아는동생이랑 수다떨면서 먹기 너무 좋았습니다 😀 / 플렘므 수플레는 입에 넣자마자 위로가 되는, 보기에도 예쁘고 입에는 더 달콤한 수플레 입니다.  크림브륄레 수플레는 커스터드 베이스로 크림이 꾸덕꾸덕하고 달달하면서 묵직한 맛이 특징적이고(위의 얇은 설탕 결정이 부드러운 크림이랑 어우러져서 입안에서 바르작거리는 식감이 너무 좋습니다), 일반 수플레는 생크림 베이스로 식감이 퐁실퐁실하고 보다 맛이 산뜻한 차이가 있습니다. 두 수플레 모두 크림이 너무 맛있고, 너무 단 것을 좋아하지 않는 저 같은 사람들도 즐겨 찾을 맛입니다.  올라가는 과일 역시 어떤 조합이 수플레와 어울리는지 고심하신 것이 느껴질 정도로 디테일이 살아있습니다.  가게 천장이 높아 갑갑함이 없고, 테이블 사이 간격도 넓어서 여유롭게 먹고 가기 좋습니다. 최고!! / 연남동 수플래 팬케익 맛집!!! 크림브뢸래 수플래 진짜 맛있어요!!!! 분위기도 좋아요~ 사장님도 진철해요! 🫶🏼 / 운좋게 웨이팅은 없었지만 야외테이블밖에 자리가 없어서 야외에 앉았어요. 건물 사이의 볕이 안드는 야외라 아직은 좀 춥습니다ㅎㅎ  팬케잌은 주문이 밀려서 나오는데 40분 조금 넘게 걸렸고 커피 먼저 부탁드렸는데 커피도 20분정도 걸려서 나왔습니다.   팬케잌은 식감 몽글퐁싯하고 아주아주 맛있어요. 크림이 너무 달지 않아서 싹싹 긁어먹었고 과일도 막 쪼글거리고 불량 과일아니고 싱싱뽀독한 과일이라 식감도 맛도 너무 좋았어요. 커피랑도 잘 어울렸네요ㅎ  결론-팬케잌은 왕존맛이지만 사람 많을때 가면 오래걸리고 야외석은 아직 좀 춥다. / 커피는 그냥 그런데 수플레 팬케이크가 진짜 맛있어요.  팬케이크 좋아하시면 꼭!! 꼭 가보세요 / 진짜 맛있게먹었어요!! 수플레는 시간이 걸려서 와플먼저 나오고 조금 기다렸어요 점심시간이 짧아서 급하게 먹느라 아쉬웠어요ㅠㅠ / 커피를 한 잔 마셨어서 오늘은 밀크티와 차도 시켜봤는데요 이런 메뉴들도 너무 괜찮았어요!! 어쩌다보니 오래 있게 되어서 디저트도 먹었는데 여전히 너무 맛있어요.. 수플레는 먹을 때 마다 생각하지만 정말 대박입니다 꼭 드셔보세요... 기본도 맛있고 멜론이나 딸기도 맛있지만 크림브륄레가 전 제일 맛있는 것 같아요 강추드립니다!! / ",디저트가 맛있어요,커피가 맛있어요,친절해요
1215983970,표정,,"카페,디저트",,"홍대당일케이크 주문 되는 곳 찾다가 방문하게 되었어요! 케이크가 필요했는데 예쁜데 맛있기까지한 케이크를 당일에 구매할 수 있어서 정말 좋았어요!  꾸덕한 초코 케이크가 커피와 와인이랑 모두 잘 어울렸어요❣️ / 사장님이 친절하시고 원두를 기계가 아닌 힘으로 직접? 내리는건 처음 봤다 정성이 더 들어가는 느낌?!  자리에 테이블 같은 것도 있고 식기도 정갈하게 놔주시고 그래서 되게 대접받는 느낌이 들어서 너무 좋았다. 그래서 더 맛있게 느껴졌다. 수박바 맛이 나는 원두를 골랐는데 진짜 맛이 느껴져서 신기했다.. 라떼도 맛있고 최고였다 굿굿 / 엄마 생신케이크로 하트모양이 넘 귀엽고 이뻐서 포장주문했는데 사진보다도 실물이 훨 귀엽고 이뻤고 매장내에 깔끔하니 이쁜 해피벌스데이 초도 꽂아서 생일케이크했어요 초쿄함량도 많고 너무 너무 맛있게 잘 먹었고 가족모두 만족도가 높았어요 이벤트케이크는 표정에 초코하트 구겔호프케이크 입니다 😍👍 / 케이크도 맛집인데 구겔호프라는 디저트도 고급스럽게 생기고 진짜 엄청 맛있어요ㅠㅠ 홍대 숨은 디저트 맛집이라고 생각할 정도🥹..눈으로 봐도 맛있는데 실제로 먹었을 때도 진짜 재료에 아낌없이 좋은 거 쓰셨구나. 라고 느껴질 만큼 맛의 정성이 느껴지는 맛ㅠㅠ이벤트용, 생일 때 하기도 너무 좋은 케이꾸 추천 ! / 친구 생일이라서 당일로 구매한 하트케이크인데 친구가 너무 좋아해서 만족스러워 후기 남겨용❤️ 초코 좋아하시는 친구한테 선물로 주기 너무 딱이에용!! 안에 초코가 엄청 꾸덕하고 고급진 초콜릿 맛이라서 너무 맛있더라고용!!! 일단 모양자체가 어디서 볼 수 없는 귀여운 하트모양에 누구나 이 케이크를 받으면 기분이 좋아질 거 같아용!!! 인스타 갬성 막 나는 케이크 찾으신다면 무조건 표정으로 오세효!!!!❤️❤️❤️ / 너무너무 좋아하는 매장입니다. 친구 생일케익 준비할때 특별하고 맛있는 케익으로 당일 주문하기 좋고, 구겔호프 박스같은 경우는 친구네 집 갈때 가볍게 선물하기 좋아요!! 맛까지 좋고 포장 패키지까지 완벽하니,, 자주 찾게 되는 곳입니다 / 구겔호프 처음 먹어보는데 완전 쉬폰케이크처럼 부드럽고 달달해서 보기에만 예쁜게 아니라 완전 맛있더라구요!!!  전체적으로 다 달달한 편이었는데도 각각의 맛이 잘 느껴졌어요 👍🏻 포장도 넘 깔끔하고 비주얼부터 예뻐서 선물용으로도 딱일 것 같아요 또 먹고 싶네용 / 하트초콜릿케이크가 유명한 연남동 표정🍫 다들 예쁜 케이크를 예약해두셔서 매장에서 달콤한 초콜릿냄새가 솔솔 나요!!  저는 매장에서 구겔호프+브루잉 세트 이용했습니다!  바리스타님께서 원두 설명 친철하고 꼼꼼하게 해주셔서 제 취향에 맞게 너무 맛있게 잘 마셨어요!!  레밍턴 구겔호프가 있어서 고민없이 바로 골랐는데 아주 잘 한 선택인 것 같아요☺️  혼자서 이용하기에도 불편하지도 않았고, 아늑한 바테이블 공간이 좋아서 다시 가고 싶은 곳이에요!!  연남동 근처에서 좀 색다른 분위기의 카페 찾으신다면 표 정 입니닷  🍒🍫❤️ / 구겔호프 케이크 진짜 먹어보고싶었는데 드뎌 get했어용 ㅠㅠ 매장도 넘 깔끔하고 특히 포장이 넘 세련되어서 선물용으로 딱 좋을 것 같아요! ( 전 제가 먹지만..ㅎㅎ) 도넛도 맛나보여서 먹고픈데 담에 사보려구용 ㅎㅎ🫶🫶 / 구겔호프전문점은 첨봐서 궁금해서 포장했어요!! 포장해보니 구겔호프박스 집들이 선물이나 지인들한테 선물하기 좋읗 것 같아요!! 매장에 준비되어있는 구겔호프케이크 보니 케이크도 너무 맛있어 보이고 초코 향이 장난아니더라구요! 다음에는 구겔호프티라미슈도 꼭 먹어보고싶어요!",디저트가 맛있어요,특별한 메뉴가 있어요,친절해요
1136436599,플롭 연남,,피자,,"매장 뷰가 좋아요. 피자는 콰트로 치즈가 제일 맛있어요.  옥수수는 달달한 거 기대했는데  예상과 다른맛.   스위트포테이토(고구마)는 맛없는 건 아닌데 감자튀김 먹을걸 하는 아쉬움이 있네요.  양이 많아서 옥수수, 페퍼로니  한조각씩 포장 해서 왔는데  조카가 먹더니 맛있대요.   여럿이서 다양하게 먹기 좋아요. / 수타 도우의 쫀뜩함과 푸짐한 토핑으로 한 입 가득 행복을 먹을 수 있는곳!  도심속의 힐링스팟으로 연인간의 데이트, 친구들과의 가벼운 자리에도 좋은곳! 피자만 먹어도 좋고, 맛있는 생맥주와 함께 즐기면 더 좋은 곳! / 오랜만에 발견한 연남동 피자맛집입니당!!! 분위기도 너무 좋고 💗💗 메뉴도 하나하나 다 맛있어요! 피자 종류도 다양해서 선택권도 넓고 평일인데도 사람이 많은 이유를 알겠더라고요 제가 근래 먹어본 피자, 파스타중에 젤 맛있었어요! 조만간 또 재방문할게요 👍🏻 / 연남동에 오면 항상 방문하는 찐단골 맛집 플롭 💛 피자 존맛탱이에요. 불고기피자는 일반 프차 피자랑 비교하면 절대 안됨. 새로운 맛이에요🩵 펜네 파스타도 새콤한 맛이 강하지않고 맛있게 먹기 좋아요. 연남동 맛집추천💛 분위기 깡패여서 여친델꼬가면 칭찬들음 😘 홍대 연남동 피자 맛집 찾으시면 플롭 추천드려요💛 피자는 바질이랑. 불고기. 포테이토 존맛입니당 / 다른지점 가보고 연남점은 처음인데 매장이 예쁘네요 둘이 갔지만 쿼터로 4가지 피자 야무지게 고르고 남는건 포장해왔어요~치즈가 많이 들어있어서 더 맛있는 것 같아요~그리고 사이즈 대비 가격대도 좋은편입니다 / 레터링피자 예약했는데 비주얼이 너무이뻐서 먹기 너무 아까웠어요ㅎㅎ생일날이었는데 분위기랑 비주얼이랑 맛도 너무맛있어서 정말대만족합니다.남자친구도 맛있게 먹어서 뿌듯했어요.담에도 재방문할게요. / 친구 생일파티 하려규 레터링피자 예약했는데 넘 예쁘고 맛났슴당 / 데이트 하러 방문 했어요🎀 핏자 푸짐하고 다 맛있었어요!! 피자 좋아하는 남친이 반하고 왔잖아요ㅎㅎ  ((안갔으면 큰일 날 뻔)) 아기자기한 분위기여서 여자들이 딱 좋아할 곳이에요! / 홍대연남동 맛집 북적거리는 곳만 다니다가 골목에 분위기있는곳 있길래 피자맛집 찾다가 플롭 다녀왔어요!! 줄서는식당 나온집이라더니 정말 맛있습니다 🫶자연산 100%치즈에 쫀뜩한 수제피자가 먹고싶다면 !!! 무조건 플롭 추천입니다~~ 🤤 친구랑 왔는데 분위기 너무 좋아서 다음에 또 오고싶다고 계속 이야기했어요! 데이트코스로도 너무 좋고 왜 대기가 많은지 알겠어요!! 네이버에약이나 캐치테이블 예약 무조건 하시고 맘편히 다녀오세요~ 아 그리고 하프앤하프에 필수 메뉴 대파크림오븐파스타 꼭 추가하세요!!! 대파향에 크림 꿀조합.. 피맥의 끝판왕아에요~~피자&파스타 모두 미쳤습니다! 너무 맛있고ㅠㅠ 플롭 다음에 또 방문할게요💘 / 둘이 먹으면 배부르고 딱 좋아요! 불고기랑 쉬림프 반반했는데 새우도 탱글탱글하고 달달하고 둘 다 넘 맛있어요❤️❤️ 다음에 또 올게요~~",음식이 맛있어요,인테리어가 멋져요,특별한 메뉴가 있어요
1982138495,이미올드맨션,,케이크전문,,"아늑한 2층 주택에 홍대 유명카페 이미의 새로운 공간이 오픈했어요!  연남동 숲길, 경성중 옆 골목에 숨겨진 주택개조카페로  짙은 우드톤의 레트로한 감성이 남아있는 인테리어 속, 격자 무늬의 창문이 매력적인 공간🏠  이미 본점에서 인기가 있던 메뉴이자 수요미식회에 소개되었던 빙수와 처음 선보이는 메뉴 스프, 세상에서 제일 맛있는 바닐라라떼인 ‘세젤바’ 등을 맛볼 수 있는데 주문하는 메뉴마다 맛이다 좋았습니다😁 / 가게 자체가 무척 분위기있고 예뻤어요 감자스프, 세젤바, 바질토마토를 주문했습니다 세젤바 주문하면서 너무 달까 고민했더니 많이 달지않다고 추천해주셨어요  메뉴 하나하나 다 맛있었습니다 바닐라라떼 세상에서 제일인진 모르겠지만 지금까지 제가 먹어본것중 가장 맛있었습니다 딱 적당한 당도에 부드럽고 바닐라 향은 진해서 매우 만족스러웠어요 감자스프같은경우는 제가 원래도 워낙 좋아하는 메뉴라 객관성은 떨어질수 있지만  꾸덕하거 찐득해서 맛있게 먹었어요 다만 전 개인적으로 페스츄리스틱?보단 빵이었다면 더 좋았겠다 싶었어요 바질토마토는 아무래도 바질크림, 토마토, 발사믹 조합이다 보니 카프레제샐러드같은 느낌을 줬어요 페스츄리도 아주 바삭했습니다  다음엔 다른 스프와 빙수를 먹어보러 갈생각입니다 / 크리미오렌지빙수 맛이 깊고 신선한 맛이었습니다. 세젤바 바닐라라떼는 향과 맛이 평범하지 않으며 오랜된 프로의 맛이 느껴집니다. 디저트의 페스츄리의 바삭함이 특별합니다, 더위를 식혀주는 올드맨션에서 잠시 쉬었다가 여유를 찾아 가세요~^^ / 오픈하기 전에 도착했는데도 사람들이 대기하네요. 가장 구옥의 형태를 그대로 카페로 만들어서 그런지 분위기 있습니다. 좌석은 많지 않지만, 각 자리마다 느낌이 살아 좋네요. 디저트는 다른 곳에서 맛보기 힘든 느낌의 향과 체험을 제공합니다. / 이미커피도 좋았기에 이곳도 기대가 컸는데요 기대이상이네요. 오렌지빙수... 이런 맛에 이런 가격이라니.... 신라호텔 망고빙수 저리 가라입니다! 스프도 넘 맛있구요...월요일에 쉬는데 여기 다시올까봐요~~~ 최고!!!!! / 믿고가는 이미커피... 말이 필요가있나용.. 오렌지 빙수 진짜 고급진 맛... 최고였어욤... 조만간 또갈게요 헤헤 💖 / 예쁜집에 맛있는커피 역시 이미커피 / 모든게 완벽한곳 이미는 사랑 / 곧 번잡해지겠죠? 👍🏽",인테리어가 멋져요,커피가 맛있어요,디저트가 맛있어요
