id,title,score_val,category,descript,reviews,keyword1,keyword2,keyword3
1588980015,에브리띵베이글,4.51,베이글,,"요즘 베이글에 빠져서 정보를 찾아 보다가 오게된 베이글 맛집 입장하면 시선을 끄는 독특한 인테리어가 눈에 띄고 사장님 두분이서 분주히 움직이는 모습이 보여요  전 추천받은 팻맨 먹어봤는데 첫입 먹자마자 맛있단 생각이 바로 들정도로 제 입막네 취저였습니다.   가게랑은 가깝지 않아 자주는 못와도 이 근방에 올일이 있다면 또 가고싶은 집 이었네요 / 일주일에 세 번이나 방문한 곳! 겉은 탕후루 같이 바삭하고 안은 쫄깃하구,,, 개인적으로 레인보우베이글 평일에도 나왔으면 좋겠어요!!! 색이 이뻐서인지 맛도 더 맛있는 거 같거든요☺️ 직원분도 엄청 친절하세요~ / 요새 런던 스타일 유행이라 뉴욕스타일 베이글, 맛난 곳 찾기힘들었는데… 정말 뉴욕살이 추억 돋을만큼 맛있는 베이글이었어요. 매장 자체는 작아서 안에서 먹기는 힘들지만 베이글 맛나요. / 오랜만에 온 에브리띵베이글 담백하고 맛있는 베이글에 에브리띵베이글 가게만의 색과 분위기 다시 만나 뵙고 인사 나눈 선생님도 뵈어 참 좋았어요~🎼☺🙏 감사드립니다~오늘 하루 편안하고 좋은 하루되세요~🌳🌊🌈 / 개인적으로 메이플호두 크림치즈는 별로였어요 메이플 호두 둘다 맛이 안나고 그냥 크림치즈맛 다음번엔 유명한 파 들어간 크림치즈로 먹어볼게요 베이글은 쫄깃하고 맛있어서 베이글만 먹어도 맛있을 거 같아요 / 미국 스타일의 질깃한 오리지널 베이글을 팔아요!😊 크림치즈랑 궁합이 좋으니 크림치즈도 꼭 사세요:) / 집에서 아주 가깝고. 베이글맛집이라고 소문은 많이 들었지만 일을 하다보니 가게가 열려있을 시간에 들리기가 힘들었어요. 3년만에 드디어! 처음으로! 들어와보네요. 아직 먹어보진않고 포장해서 집에만 갖다놓고 다시 일정상 일터로 이동… 어서 퇴근하고 가서 먹어보고싶어요~~~ / 에브리띵 베이글 + 크림치즈쪽파 맛있어요👍 / 당일 갓 나온 베이글에 크림치즈 발라서 먹으면 정말 맛있어요. 어제 나온 베이글도 50프로 할인! / 호밀에브리띵베이글에 쪽파크림치즈를 추가했습니다. 사장님 친절하고, 포장도 허투로 하는거 없이 꼼꼼하고 정성이 느껴집니다. 냉장고에 뒀다가 다음날 아침 집에서 커피랑 먹었는데, 너무 맛있습니다.",빵이 맛있어요,특별한 메뉴가 있어요,친절해요
1438596542,심야식당 텐조,,이자카야,,"새로운 메뉴도 맛있어요. / 2번, 3번..  그 이상 갈곳!!! 나만 알고 싶은곳!! / 우리에게 3시간은 너무 아쉽다ㅠㅠㅠ 안주 맛있고 분위기 좋고  친절하고!!! 단지 3시간이 아쉬울뿐 ㅋㅋㅋㅋ  작은 동네 작운 술집이지만 큰 기쁨을 주는 곳이다!!! / 맛있게 잘 먹었습니다. 음식이 생각보다 수준이 있네요. 다른 안주도 한번 먹어보고 싶습니다. / 둘이 와서 안주 세 개 시켜 먹게 하는 곳,, 그만큼 맛집술집♥ 서비스 감사합니다 사장님 애정하여요🫶🏻🤍 / 일주일?만에 생각나서 또 갔어요 !! 부천에서 절대 가까운 거리가 아니지만.. 사시미는 진짜 여기만큼 맛있는 곳이 없기 때문에..🤡❤️ 매번 같은 메뉴지만 사시미, 해물야끼우동, 꼬치(목살,염통)은 진짜 언제 먹어도 맛있기 때문에ㅠㅠㅠ❤️❤️ 항상 술 없이 먹다가 어제 처음으로 술 3병 까고 왔는데, 술을 행복하게 먹을 수 있는 안주들이었습니다..🫠❤️ / 진짜 존맛탱❤️메뉴 다먹어봐야지 / 심야식당 텐조 증산역 일본선술집풍 이자까야! *고등어봉초밥₩19,000ㅡ가격대비 넘 맛있슴 *사시미39₩39,000ㅡ가격대비 회 종류 다양성 상! 신선도 중! 분위기 넘 새롭 ㅋ *자기 술잔 고르는 이벤트는 별거 아닌듯한데 앉자마자 웃으며 시작하는 ㅎㅡ아이디어 굳  재미있고 맛있게 먹고 갑니다.ㅎ 고등어 봉초밥먹으로 재방문 의사~!* / 항상 맛있음 직원 친절함 / 숙성회랑 도쿠리 사케 맛있음",음식이 맛있어요,술이 다양해요,친절해요
1917836906,카시코이,4.64,"카페,디저트",,"먹기도 아까운 화과자들!! 그리고 제가 여기사 맛집이라고 자신 있게 말할 수 있는 이유가!!! 위층에는 화과자 클래스를 하고 있어서 사장님이 위에 계셨는데 일본인 관광객이 주문하러 오신 거 있죠?? 일본인이 굳이 한국에서 화과자 집에?? 사장님 친구분이신가 했는데 그 일본인 관광객이 저에게 사장님 어디 갔냐고 불러달라고 하셔서 불러드렸더니 주문을 하시더라고요??? 일본인이 한국에서 화과자를 먹으러 오는 곳! 그리고 당고를 30개 이상 주문하는 손님이 있어서 깜놀! 그런데 맛을 보면 그럴만해요! 쫄깃한 당고에 깔끔하고 고급스러운 말차! 그리고 레몬 상큼한 토끼와 딸기 달콤인 수국까지 완벽한 곳이었어요! / 일본 나고야에서 직접 배워오신 사장님이 운영하시는 화과자 카페 🐰  통창으로 내부가 화사하고 식물로 꾸며진 인테리어가 좋았습니다 🌲 가운데에 나무를 빙 둘른 네모난 바 형태의 테이블이에요.  가게가 아담한 편이라 주말에 사람 몰릴 시간이면 웨이팅을 해야될 수도 있고, 매장 앞에 주차가 가능하니 방문 전 미리 문의해주시는 게 좋을 거 같아요🚗  떡과 비슷한 식감이지만 사이즈가 크지 않고 앙금과 꿀을 사용하여 매우 달달한 편이에요! 화려한 색감, 예쁜 모양에 고급스러움은 덤이라 어르신이나 중요 모임에 선물할 일이 있으면 원데이 클래스로 찾아가려구요 ><  매달 1일에 계절을 주제로 라인업이 달라진다고 하여 ""가을에는 어떤 화과자가 나올까??"" 기대가 됩니다 ◡̈ / 너무 예쁜 화과자를 만날 수 있는 카페예요! 화과자 특성상 화과자만 단독으로 먹는 것보다는 음료와 함께 세트로 드시면 좋아요~ 라인업이 매달 바뀌어서 자주 방문하게 되네요😊 연희동데이트 코스로 추천합니다. / 미타라시 당고는 처음 먹어보는데 소스하고 떡이 잘 어우러져서 너무 맛있었어요 ㅎㅎ 화과자도 구매했었는데 매장 샘플보고 고를 수 있어서 좋아요! 너무 예뻐서 구매한 화과자는 모두 선물했는데 선물 받은 분들이 무척 좋아하셨어요 ㅎㅎ 담번엔 제가 먹을 화과자 사러 가려구요!😋 / 사람 많은 연남동쪽에서 떨어진 곳에 있어서 카페 내부는 자리가 그렇게 많은 편은 아니지만 사람들이 적어서 여유롭게 화과자랑 음료를 먹을 수있는 카페임  화과자 + 음료 세트가 있어서 조금 할인된 가격으로 먹을 수 있는 점이 좋음  토끼 화과자처럼 진짜 귀엽고 이뻐서 먹기 어려운 비주얼들인데, 맛도 일반 화과자보단 안에 내용물 맛들이 상큼하게 올라와서 달달하면서 좋았음  화과자에서 당고 메뉴도 있는데, 이걸 완전 추천함!! 일본에서 먹은 당고보다 엄청 맛있고 떡이 완전 쫀뜩거림   조용히 카페에서 이쁘고 귀여운고 보고싶을때 오기 좋은 카페인듯! / 햇살맛집 카시코이♥︎ 아침에 와서 차랑 같이 화과자 하나 먹으면 완전 힐링 그 자체에요 ㅜㅜ 화과자 비주얼도 너무 예쁘고 특이한게 많아서 좋았네요 아니 그리구 당고는 정말 일본에서 먹은것보다 맛있더라구요!!! 취향저격 당해버렸음... ㅎ 자주올게요 선물용으로도 딱일것 같은 연희동카베네요 / 너무 귀엽고 아기자기해서 먹기 아까웠어요,,💕정성 가득 들어간 만큼 값어치를 한다고 생각해요 포장 구성도 다양해서 나중에 선물사러 다시 방문하고 싶어요!! / 서울 서대문구 연희동 카시코이 카페  -연희동 당고 화과자 카페!! -정갈하고 아기자기한 일본 디저트!  *카시코이 카시코이세트 화과자1, 음료1(₩11,000)  화과자  소풍가는토끼: 유자맛 앙금 화과자 봄날의정원: 말차맛 앙금 화과자  푸르른 냇가: 피스타치오 맛 화과자  숲속의말차:말차+부드러운 우유가 만난 말차라떼  -모든 화과자가 색도 곱고 예쁜 꽃장식   -이렇게 귀엽고 통통한 토끼 한입베어먹으면 유자앙금+유자향이 입안가득 퍼져서 상콤한맛!!  -푸르른 냇가 강추!! 나의 원픽!!!화과자!! (피타치오 맛 러뷰러뷰!! 피스타치오 너무 고소하면서 맛도리 그잡채!!)  *sns인증시* -예쁜 보석 양갱 제공!!  -보석양갱+ 금가루!! = 달달하기만 한 양갱이 아니라 맛이 다름 이거 꼭 먹어보세요 / 당고 좋아해서 연희동에서 친구 만나기 전에 나눠 먹으려고 들러서 포장했어요. 윗층에서 작업하시는 거 같고 연락드리면 1층에 내려와서 응대해주십니다. 화과자도 예뻐서 선물할 일 있을 때 생각날 것 같고, 이번엔 포장이었지만 큰 테이블도 있고 조용해서 대화하기 좋은 공간이에요. / 연희동 카페 카시코이! 정말 예쁜 화과자를 맛볼 수 있는 곳이에요! 사실 화과자는 아무 곳에서나 먹을 수 없어서 별로 기대를 안하고 갔는데 정말 너무너무 예쁘고 맛있어서 또 방문하고 싶은 곳 중의 하나입니다..!",디저트가 맛있어요,특별한 메뉴가 있어요,친절해요
38251606,마세,4.58,요리주점,안주가 맛있는 작은술집,"이번에도 분위기 좋은곳에서 맛있는 음식이랑 쟈밌개 얘기하고 갑니다!!! 신메뉴 넘넘 맛났어요..🫠🫠 / 음식두 맛있구 술도 맛있구 분위기도 좋구,,,,안 갈 이유가 없쟈냐요 🌝 진짜 꾸준히 오는 내 최애 맛집~~~ 내 칭구들 다 데리고 한번씩 꼭 와야디이 !!!! / 뇨끼랑 가지타코 맛있어요 두유하이볼도 먹었습니다 분위기도 좋고 맛있어요 / 분위기가 너무 좋았던 연희동술집 마세🕊️ 예전부터 가고싶었는데, 작은 비밀공간에 있는 느낌이었어요! 2차로 간단하게 칵테일한잔하기 좋은 곳이에요! 감자옹심이뇨끼 먹었는데 크림에 트러플향도 은은하게 나고 옹심이도 엄청 쫀득해서 맛있게먹었습니당 ♫•* / 간단하게 술 한잔 하기에 너무 좋아요! 안주도 훌륭하네요 가지타코 진짜 맛있어요!!!! / 데이트하기 좋고 음식도 맛나요 특히 명란파스타 존맛 / 저녁 못먹고 버스타고 집에 가는 길에, 급배고파져서 연희동에 내려서 검색하고 갔는데 제가 좋아하는 크림뇨끼도 있고 스마일 계란 후라이도 기본안주로 주셔서 하이볼과 맥주 혼밥혼술하고 왔어요:) 크림뇨끼 꾸덕꾸덕라고 고소느끼한게 딱 제스타일이였어요😋 담에 또가서 다른 메뉴도 먹어보고 싶네요- / 🩷청어알쌈 🩷1인 1뇨끼(꾸덕꾸덕 크림…🥹👍🏼) / 두유하이볼 마시러 삼차쯤 가는 곳 / 그냥 헤어지기 아쉬워 연희동 거리를 어슬렁 거리다가 찾은 3차로 당첨된곳! 가볍게 한 잔하기 좋아요",음식이 맛있어요,음악이 좋아요,친절해요
1708381623,해피앤피스커피클럽,,"카페,디저트",,"아기자기하고 귀여운 카페 좋아하는데 인스타에서 보고 여기가 딱그래서 찾아가봤어요~ 금요일 오후 5시넘어서 방문했지만, 여름이라 해가길어서 그런지 햇살이 잘들어와서 자연광에 메뉴들 사진찍을수있었어요~!  보통 메뉴가 귀여운것들은 귀엽기만하고 너무달기만하고 맛이 별로없던곳이 많았는데 여긴 다맛있었어요~~!!!! 케잌이 정말 기대와 다르게 맛있었어요!! 음료 케잌이 맛있어서 한번더 가고싶고 갈거에요~! 그릇들도 메뉴랑 어울리는접시에 주셔서 사진이 너무 이쁘게 나왔어요~! 평일인데도 사람이 많아서 시끌시끌했지만 다행히 웨이팅없이 바로입장해서 좋은 창가자리앉았던건 너무 좋았어요! / 음료도 너무 맛있구 카페 분위기도 좋았어용 🍀🫧 여름과 너무나도 잘 어울리는 카페네요 ! ! 행복 가득 충전하구 갑니당 🫶🏻 / 연남동 해피앤피스클럽 ✨️ 아기자기한 디저트가 귀엽고 혼자 방문하기에도 좋다 / 복숭아 요거볼 & 트로피컬 리치주스 예쁘고 맛있어요 / 라즈베리소르베 레몬에이드 맛있었어요! 케이크도 맛있었는데 아무래도 색소를 써서 만든 거다보니 이빨이 파랗게 물들더라고요ㅋㅋㅋㅋ 친구랑 서로 이빨 보면서 웃었네요 / 맛은 모르겠는데 아늑하고 좋아요 그리고 디저트들이 다 너무 귀여워요 / 맛은 있었습니다만... 왜 맨손으로 일하세요? 음료에 올라가는 통조림 파인애플, 용과, 체리 다 맨손으로 올리시고 케이크에 올라가는 강아지데코 초콜릿 다 맨손으로 하시더라구요? 제가 주문한거 받을땐 몰랐어서 그냥 먹었어요; 손을 닦으셨다고 해도 그게 진짜 100프로 위생적이라고 생각하세요? 핸드폰 만지고 포스기 만지고 카드 받고 손 안닦으셨잖아요 주방이 그렇게 오픈돼있는데 그런게 아무렇지 않을거라고 생각하셨으면.. 정말 큰일날 이야기인거같습니다 코로나 이후로 위생에 더 민감하잖아요.. 사장님이신지는 모르겠지만 사장님이시라면 위생교육 다시 받고 오셔야할것 같구요 직원분이시라면 사장님이 꼭 아셔야할것 같네요 / 너무너무 귀여운 케이크 집💙💙💙 하트치즈케이크 보고 고민도 안하고 바로 달려왔습니당 / 디저트가 완전완전 귀요웠슴니다! 솔직히 집가까이 있었으면 자주 갔을거 같아요...!!! 한번쯤 와보시는거 추천드립니당! / 진짜 메뉴 다 먹어볼때까지 갈꺼다",디저트가 맛있어요,음료가 맛있어요,커피가 맛있어요
1518411270,보케,,"카페,디저트",,"워낙 네잎클로버 케이크로 유명해서 갔다왔어요 🍀 사실 맛보단 비주얼이 뛰어나서 큰 기대 안 했는데 생각보다 맛 괜찮았어요. 물방울로 표현한 건 설탕같아요. 다음번엔 고구마산도도 먹어보고 싶어요.. ♥ 저는 운좋게도 주말 점심시간에 웨이팅없이 바로 앉았는데 2-3시 이후부턴 웨이팅 생기더라구요. / 청량하고 시원한 느낌? 그리고 포근한 느낌이 공존하는 카페에요~~~ 자리도 널찍하고 좋아요~~~후르츠산도 맛있어요 / 네잎클로버가 장식되어있는 케이크가 너무 독특하고 이뻐요! 안에 있는 라즈베리가 상큼해서 느끼하지 않아서 맛있었습니다! 😻 다만 가격은 조금 비싼 편… / 네잎클로버 케이크 특이하고 예뻐요  하지만 9,000원 내고 먹을 맛은 아닙니다 분위기는 좋고 직원분들도 친절하세요 고구마브륄레산도가 궁금해서 한 번 더 방문 하려고요 / 네잎클로버 케이크 귀여워요 / 사장님도 친절하시고 음료와 디저트 맛있었어요!^^ 행운 얻어갑니다ㅎㅎ / 기대를 안고 일요일 2인 방문.  아메리카노+산도+케이크 주문요청했으나 1인 1음료로 주문 어려움. 바질에이드 추가 주문하여 28,600원 결재.  조각 케잌은 딸기 시럽 같은게 들어있었는데 무슨 맛인지 알 수 없었고 기대했던 산도는 정말 작디 작은 사이즈에 얇은 샌드위치빵으로 구성 되어 매우 실망. 토마토바질에이드는 슈가시럽+물 마시는 맛이었어요…! / 맛 : ☆☆ 가격 : ☆☆  케이크 맛은 그냥 그런데 너무 비싸요.. 그리고 롱블랙은 너무 연합니다.  그냥 일반 아메리카노라고 하면 괜찮을 수도 있는데 진한 거 기대하고 먹었는데 아쉬웠습니다.  다른 카페 롱블랙이랑은 많이 다르네요. / 고구마브륄레 산도가 정말 궁금했는데 너무 맛있었어요. 커피도 맛있고 직원분도 친절하셨어요. 주말에는 노트북이용이 제한된다고 알고 있는데 평일에 갔을 땐 괜찮았어요! 평일 12시-2시 사이에 이용했는데 비가 와서 그런지 자리는 꽤 널널했어요 / 네잎클로버 케이크 정말 귀엽습니다ㅠㅠ🍀",커피가 맛있어요,인테리어가 멋져요,친절해요
12958754,지호한방삼계탕 연희점,4.41,"백숙,삼계탕",농림축산식품부 제공 안심식당,"얼큰 덜맵게 추천이요👍 몸보신하러 오랜만에 지호한방삼계탕 방문했어요‼️ 들깨랑 얼큰 좋아하는데 얼큰이 안 그래보여도 생각보다 칼칼하고 매워오 그래서 오늘은 덜맵게 요청드려서 맛있게 식사했습니다🫶 국물이 넘 진하고 닭고기도 부드러워서 맛있어요💓 / 한약재도 팩,, ㅠ 뭔가 아쉬운 양이었습니다 / 삼계탕이 생각나서 찾아간 곳인데 유명한 곳인가봐요 연예인 싸인도 많이 있고 맛도 깔끔하고 좋았어요 복날에 가면 좋을듯 / 제가 2-3년 전에 자주 갔었는데 사장님이 계시면 정말 친절한걸로 알고 있습니다. 근데 오랜만에 삼계탕 먹고싶어서 먼길에서 기분좋은 마음으로 걸어왔는데 들어가자마자 한명이라고 하니까, 직원분 정말 불친절하셔서 사장님 계시면 꼭 말씀드리고 싶었습니다.. 맛은 정말 있어요. 비싼만큼 맛있게 먹었지만 좋은 기분으로 나오지 못했네요.. / 맛있었어요 삼계탕 먹고 힘이 나는듯해요 / 굿 / 지호삼계탕 맛나요 / 굿. 건강해지는 느낌. 인삼주도 주네요 / 맛있고 친절하심 / 든든하게 한끼 잘 먹고 갑니다! 제 몸에 영양 가득 채웠고요! 반찬도 깔끔하고 굿!  여자 사장님 목소리가 우아하면서 고우셔서 자꾸 말 붙이고 싶네요 ^^",음식이 맛있어요,주차하기 편해요,친절해요
1166922529,또또,,요리주점,,"오랜만에 여자친구랑 만나는 날! 특별하고 맛난거 먹고 싶었는데 집근처 홍제천 주변에 이런 맛집 멋집이 있었다니! 이것은 행복이고 행운이다😆👍👍 일단 탁주의 종류가 엄청 많은 메뉴 구성에 메인안주로 부대찌개와 미나리수육을 시켰는데 너무나 맛있었다! 특히 부대찌개는 최근 몇년간 먹은 것 중 제일 맛있었다! 깔끔하게 정리된 매장도 너무 좋고 시원하게 창으로 된 문을 열어두고 밖을 보며 먹는 분위기도 잊지 못할 황홀한 곳!😆👍 가까우니 이제라도 자주 찾아뵐게요!😆👍👍👍 / 전날 오고 지인들과 다시 방문했습니다. 오늘은 좀 늦게, 7시쯤 와보니 웨이팅이 있었어요.  미나리 수육무침은 향긋하고 신선한 느낌이 식욕을 돋구고 두부김치? 는 재료를 두부에 올려 구우는 형식이라 더 맛있었어요. 제육볶음도 좋고,  특히 부찌는 빼놓을 수 없죠 ㅎㅎ  이 근처 술집 중에 여기만큼 다양한 막걸리를 구비해 놓은곳은 없는 것 같습니다. 드라이하거나 달콤하거나 다양한 막걸리와 깔끔한 안주가 앞으로도 꾸준히 오게 될것 같아요 ^^ / 와 C~ 부찌, 일단 부찌!! 송탄식 찐한 육수의 부대찌게 같은데 정말 맛있어요.  3번째 '집앞 맛집'으로 선정합니다. ^^  다른 안주들도 신선하고 깔끔해서 맛있었어요. 최근 약속이 대부분 중식이나 일본식 선술집이라 더 각별하네요.   그리고 다른 술집에서는 보기드문 국산 막걸리들도 많아요.내일 또옵니다. ㅎㅎ / 요즘엔 갈때마다 고정메뉴인 쫄면! 너무 맛있어요.. 진짜 안주 하나하나 다 맛있는데 도장깨기 하는 중입니다ㅋㅋ갈때마다 술도 하나씩 마셔보고 있어요. 너무 아끼고 사랑하는 동네 아지트입니당!^^ / 또또는 안주가 진짜 너무너무 맛있어요! 처음에 이런 골목에 누가 찾아올까했지만 이젠 웨이팅까지하는 맛집이 되었네요😍❤️ 제가 다뿌뜻한건 왜인지 ㅋㅋㅋ 신메뉴만 나왓다하면 달려갑니다🍻 / 저만 알고싶은 동네 술집인데 어느새 핫플이네요ㅠㅠ웨이팅도 이제 해야하지만 또또 포기못해🥰 안주하나하나 다 맛있고 서비스도 만족스러운 소울 맛집입니당 / 사장님 넘 친절하시구 음식도 맛있고 술도 맛있고… 우리집 강아지랑 같이 할 수 있어 더욱 좋았어요 또 가고 싶은 집 또또 / 데이트하러 오기 좋고 친구들이랑 와도 좋은 곳! 웬만한 보쌈 전문점보다 맛있는.. 고기 냄새 조금만 나도 못 먹는 사람이지만 하나 더 시킬까 고민할 정도로 야들야들하고 맛있어요… 한평생 무생채 싫어하는 줄 알았는데 아니었어요 무생채도 존맛탱 자주 올게요 사장님 꼭 건강 잘 챙기시고 새해 복 많이받으세요 절대 아프시면 안 돼요… 꼭.. 약속.. / 정돈되고 따뜻한 가게 분위기처럼 메뉴도 정갈하고 성심이 느껴지는 맛입니다 접근성이 아주 좋진 않지만 찾아가는 길이 반가운 느낌이 들만큼 아늑한 곳에 위치해있습니다 주류도 상당히 다양해서 고르기에 부족함이 없습니다 데이트 하기에도 너무 좋고 소중한 사람과 시간을 보내기에 이곳만큼 적당한 곳이 없습니다 그리고 사장님 너무 예쁘세요 / 음식 하나하나 너무 맛있어요!! 평일인데도 테이블 꽉찼어요 너무 유명해졌다.....ㅜ 주말엔 웨이팅 있을듯",음식이 맛있어요,기본 안주가 좋아요,술이 다양해요
1147126296,연희보리밥,,한식,농림축산식품부 제공 안심식당,"남친과 건강식이 먹고싶어서 찾다가 발견한 연희보리밥!! LA갈비정식이랑 오징어볶음정식 시켰는데 음식이 굉장히 정갈하게나와요ㅋㅋ 밥과 나물은 리필이되서 남친은 한번더 리필해먹었는데 진짜 배터지는줄 알았습니다ㅋㅋ 짱맛!! 그리고 고기랑 오징어가 둘다 너무 부드러워요!!! 짱맛 / 워낙 비빔밥을 좋아하는데 나물 종류도 많아서 보리밥에 비벼먹으니 너무 맛있었어요! 특히 참기름이 기성품이 라닌거같아서 진한 기름냄새가 너무 좋았어용👍보리밥과 나물을 다 먹으면 리필이 되니깐 기성비도 좋은 곳이에용 / 나물도 정갈하고 보리밥 푸짐하게 나옵니다. 게다가 리필이라니! LA갈비는 약간 갈비찜 같은 맛으로 좀 더 깊은 맛입니다. 전반적으로 모든 반찬이 깔끔하고 과하게 간을 하지 않아 속 편히 먹을 수 있는 느낌입니다. / 엄마랑 또 왔어요!! 역시나 맛있는 연희보리밥~ 질리지 않습니당ㅋㅋ 연희프라자 주차장에 주차하고 오면 좋아요! 나물 리필해서 먹고, 된장청국장이 좀 많이 남아서 포장까지 했어요🤣🤣 / 우선 보리밥+나물이 리필된다는 점도 너무 좋고, 갈치와 매운갈비 시켰는데 고추장갈비보단 갈치가 더 맛있었던 것 같아요! 셀프바에 미역국이랑 식혜, 강정 있는 것도 너무 센스있고 좋았어요! 맛있게 잘 먹고 갑니다🙂 / 부모님과 연희동 근처 왔다가 건강한 밥 먹고 싶었는데 발견한 연희보리밥 매장이 정말 깔끔하고 쾌적해서 좋았고 집에서 일일이 만들기 힘든 다양한 나물에 된장찌개를 먹으니 속도편하고 좋네요. 부모님도 날 드셔서 종종 부모님과 함께 오면 좋을것 같아요. / 아이둘이랑 같이 먹었는데 보리밥도 솥밥도 찰지고 맛있어서 입짧은 아이들이 엄청 잘 먹었어요 나물 리필도 되고 청국장 오징어볶음 엘에이갈비 다 진짜 맛있네요 아이용으로 밥도 공짜로 조금 주셔서 감사했어요 / 이가 약한 저한테는 연희보리밥 군산식 오징어가 딱 맞는거같아요 적당히 맛있게 매운맛 이예요 먹고서 달달한 식혜와 보리과자도 진짜 맛있어요 진짜 강추하는 맛집입니다 ^_^ / 자주오는 연희보리밥 올때마다 맛있게 먹고갑니당 나물도 슴슴하니 비벼먹으면 딱좋아요 특히 청국장이 넘 맛있어요 디저트로 있는 보리강정, 식혜도 너무 맛있습니다ㅎ / 된장청국장과 보리밥 먹었는데 간도 세지않고 집밥같이 먹을 수 있어 좋았어요. 후식으로 달달한 강정이 입안을 마무리~",음식이 맛있어요,건강한 맛이에요,재료가 신선해요
