name,rating,type,descript,reviews,keyword1,keyword2,keyword3
오마카세 오사이초밥 신촌점,,"초밥,롤",,"예약하고 방문했는데 너무너무너무 만족했어요! 재료들이 신선해서 비린내도 안났고 유자하이볼 시켜먹었는데 와 진짜 하이볼 좋아하시면 꼭 드셔보세요 🔥 인생 하이볼을 영접하고 온 기분이었습니다  남자친구와 1000일 기념 데이트로 선택한 곳이었는데 1000% 만족하고 갑니다 잘 먹었습니다 ☺️❤️ / 오사이초밥에 푹빠져 한달사이 세번째 ㅋ 강남점 홍대점에 이어 이번엔 신촌점에서 아예 모임6인~ 여전히 갓성비~~ 추가피스 우니로 먹어보고 포기하지 못하는 유자하이볼 ㅎㅎ 모임멤버 모두가 흡족해한 식사 / 가성비 오마카세의 끝판왕, 홍대점만 가다가 신촌에 와밨습니다. 역시 실망시키지않네요. 미국사시는 어머니와 여동생이 너무나 만족이네요. / 커뮤니티에서 추천을 받았다 정말 맛있게 먹은 곳이라고 했다 네이버로 예약도 하고 신나게 버스타고 달려갔다 버스가 연착이 되서 지각했는데 다행히 내 시간에 나밖에 없었다 숨 좀 돌리고 챱챱 먹었다 초밥이 1피스씩 나오더라 상세한 설명이 듣기 편했다 간장새우가 맛있었다 고등어초밥은 손으로 먹어서 신기했다 든든하게 먹고 나와서 좋다 다음에는 디너로 가봐야겠다 / 런치 이용해보고 너무 괜찮아서 디너도 이용해봤는데 어쩌다 스페샬하게 저 혼자 예약이어서 독채를 즐겼네요 그 덕에 앵콜초밥으로 간장새우초밥과 광어지느러미초밥도 서비스로 주시구 후토마키도 꼬리 두 개 독점의 행운이ㅋㅋ 런치 디너 모두 너무 훌륭해요 식재료관련 유용한 상식도 여럿 배우고 디너에는 런치에는 없는 에피타이저와 스시가 추가되서 풍성한 식사였습니다 기분내고 싶을 때 자주 찾을 것 같아요 :) / 5명이서 방문!😃 신촌에 오마카세가 생긴지 모르고 있었는데 가성비 괜찮고 맛도 좋은 식당을 찾은 것 같 아 기분이 좋아요🥰!!!! 사진에는 비록 없지만 ... / 요즘 물가에 무척 혜자로운 곳입니다. 서비스도 좋고 오마카세의 재미도 있어요. 엄마랑 같이 갔는데 무척 좋아하셨어요. 음식도 맛있어요. 다 먹으면 배... / 쉐프님이 굉장히 친절하시고 손도 빠르시고 말씀도 재밌게 잘해 주셔서 식사 하는 데는 즐겁고 음식 맛도 너무나 다 맛있어서 행복한 시간을 보낼 수 있... / 깔끔한데 친절하시고 넘 좋았어요☺️ 못먹는 초밥들은 다른 초밥으로 변경해주시고 여러팀이랑 같이 진행 되니까 덜 부담스럽고 좋더라구요 ! 그리구 요... / 공연보러 갔다가 급 초밥? 스시? 먹고 싶어서 예약하고 감. 혼술하기 좋음. 가지랑 고등어 맛있었음. 👍🏻",음식이 맛있어요,가성비가 좋아요,재료가 신선해요
연세로갈매기,4.74,"육류,고기요리",,"2번째 방문입니당~~♡ 진짜 정말 신선하고 너무너무 맛있어요 ㅠㅠ 갈매기살이 이렇게나 맛있는 부분인 몰랐는데 연세로 갈매기에서 눈을 떴습니다😲💖💖💖 반찬들도 맛있고요! 떡볶이.열무김치.마카로니.콩나물 짱짱맛짱😻 계란찜도 막창도 얼마나 맛있게요 ㅎㅎㅎ 진짜 꼭 가세요!!!! / 고기 가성비 너무 좋아요 주기적으로 가게 됩니다  서비스로 주신 치즈계란찜 너무 맛있어요  맥주가 술술 넘어가네요   소금구이막창까지 코스입니다 / 오랜만에 갈매기살을 먹으러 왔는데... 나 갈매기살 좋아하네?! 고기도 신선하고 각종 반찬들 모두 정말 맛있었어요. 부족한 반찬은 셀프바에서 제가 먹을만큼 가져올 수 있어서 좋았어요 ㅎㅎ 직원분도 정말 친절하셨고 화장실도 깨끗해서 좋았어요. 잘 먹었습니다😋 재방문 의사 111%!!! / 종종 방문하는 갈매기살 맛집이에요! 언제 가도 신선한 육질과 좋은 가격👏 오랜만에 예약했더니 치즈계란찜 쿠폰도 생겨서 맛있게 잘 먹고 왔습니다ㅎㅎ 여기 소금막창도 맛있어요! 이번에 유독 양파가 달달하게 잘 볶아져서 더 맛있었어요🤤 신촌홍대 부근 고깃집 중에 최애입니닷 또 방문할게요! / 갈매기 살이 더 맛있어졌네요!!! 부드럽고 담백하고 진짜 맛 있습니다!! 얼그레이 하이볼도 꼭 드셔보세용😄 밑반찬도 하나같이 다 맛있고 스팸치즈순두부 진짜 맛있습니다!! 또 올게요!! / 신촌 고깃집 중에 제일 좋아하는 곳🤤 이번에도 맛있게 잘 먹고 왔습니다! 외국에서 온 친구도 데려갔는데 넘 맛있었대요ㅎㅎㅎ 또 방문하겠습니다~! / 이번이 세 번째 방문인데 진짜 맛있어요 소주도 싸고 막창도 맛있고 사이드메뉴도 맛있습니다  막창 여러번 먹어본 결과  소금 + 양념이 조합이 정말 좋은 것 같아요😋 / 진짜 갈매기살 찐맛집이에요 ㅠㅠㅠㅠ 꼭 드셔주세요!!! 리뷰쓰면 치즈계란찜!까지 주시는데 모짜렐라가 쭉 ㅠㅠ 그리고 막창까지.추가했는데 역시 마무리는 막창 ㅎ / 신촌 올때마다 들리는 연세로 갈매기!! 지금까지 먹어본 갈매기 살 중에 제일 맛있는것 같아요!! 다음에 신촌 오면 또 들릴것 같아용! 잘먹고갑니다~! / 정말 오랜만에 방문 했는데도 모든것이 다 바뀐것도 없고, 여전히 고기는 신선하고 맛있고 모든 반찬이 다 맛있고 치즈계란찜은 진짜 넘사 맛있습니다!!!! 맛 양 가성비 다 너무너무 좋아요!!👍👍👍😊",음식이 맛있어요,가성비가 좋아요,고기 질이 좋아요
아민 이화,4.62,양식,,"제법 더운날, 먼거리를 찾아간 보람이 가득한 날! 이곳을 콕! 찍은 저의 선택에 어깨가 으쓱해진 날! 처음 먹어보는 색다른 음식에 기대도 컸는데 그런 기대를 배이상 충족시켜준곳이에요~♡  뱅쇼에 올리브유를 2대 1로 섞어마시는 요거, 특이했구요~ 이쁘고 다양한 플레이팅에  제대로 대접받는 느낌이라 감동이었어용~^()^ 이 느낌 그대로 먹는내내 행복했습니다~ 모든 음식이 다 만족스러워서 가까운곳에 있다면 사랑하는 사람들 한번씩 다 데려가서 맛보여주고싶네용!!! 최고의 한끼!!!  직원분들도 너무 친절하셔서 이또한 재방문 하고픈 이유입니당~♡ / 처음 먹어보는 음식이라 맛있을지 어떨지 걱정되었는데 걱정이 무색할정도로 굉장히 맛있었어요! 뱅쇼랑 올리브유를 같이 섞은 식전주도 맛있고 새롭더라구요ㅎㅎ서빙해주시고 어떻게 먹는지 방법을 친절하게 설명해주셔서 그 점도 좋았습니다💓 / 결혼 후 15년만에 신촌 나들이 리뷰 보고 선택한 아민 이화 평상시 접하지 못한 음식이라  아이들의 호응을 받지는 못했지만 타국 음식 느끼고 싶을때 특별한 음식 먹고 싶을때 추천드려요 사장님께서 알려주시는대로 드셔 보세요 음식을 배로 즐길 수 있어요 / 작년에 방문후 재방문. 메뉴와 음식나오는 방식이 살짝 바뀌고 가격은 올라간듯. 여전히 건겅한 음식 가격이 아깝지 않은 풍성한 재료 담백한 맛까지~ 이번에도 대만족! 식전주 양이 많아졌고 올리브오일 따로주고 무엇보다 아보카도 풍성한 메뉴에 감탄~ / ☆☆내돈내산☆☆  웨이팅하기 편하게 가게앞 6인용 벤치있고 연락처남기면 순서대로 전화주심  순서되어 입장하면서 테이블 먼저 잡고  가게 입구에서 키오스크로 메뉴 선택하면됨  태어나서 처음 접해본 메뉴 걱정되었는데 정.말 건강하게 맛있는 맛 적당히 매콤하고 느끼하지않음.  낯선메뉴라 어떻게 먹어야할지 모르겠어서 당황했는데 직원분이 테이블마다 서빙해주시면서 설명 친절하게 해주심 빵도 3조각정도라 배고프지않을까ㅡ했지만 샐러드랑 빵. 스프까지 먹으니 너무배불러서 스프같은거 1/3정도 남김  논알콜 뱅쇼 + 올리브오일 조합은 너무너무 새롭고 맛있었음.  인테리어는 따뜻한조명 + 약간 어두운 분위기라 마음이 편안해지고 지인들과 도란도란 얘기하는 테이블이 많았음.  내돈내산이고 서울간다면 또 가보고싶음 / 위샐러듀일 때 오고 엄청 오랜만에 오는데 뭔가 메뉴가 더 다양해진 느낌? 다양하게 시켜서 나눠먹었는데 완전 짱이었어요. 식전 음료로 나온 논알콜 뱅쇼랑 엑스트라버진올리브유 섞은 것도 상큼했어요~ / 너무 이색적이고 맛있네요! 계속 생각나는 맛이예요~ 이전에 있던 메뉴도 있었으면 좋겠어요^^ / 맛집이란 말만 듣고 찾아간 집.   아이들은 지중해 음식을 처음 먹어봐서 기대하지 않았는데, 아이들도.. 부모님도 다들 넘넘 맛있게 먹었어요. 모습만 지중해가 아닌 맛도 지중해~   모든 메뉴가 하나같이 다 맛나고,  또 무알콜 뱅쇼를 주는데 것도 아이들은 신기해하며 같이 잘 마셨어요.   강추 음식점!  기대치 않고 왔다가 맛집리스트에 올린 찐맛집! / 지중해식 요리들을 접하기 힘든데 굉장히 잘 구현해주신 것 같아요. 한 번쯤 가보면 좋을 것 같은 식당입니다. 추천해요!  인테리어도 예쁘고 음식도 건강식 또는 비건인데 생각보다 양도 푸짐하고 맛있어요. 신기한 메뉴들이 많아서 다음번에는 다른 것들도 먹어보려고 합니다! 🌱😊 / 지중해 음식  먹는 방법도 설명해주고 무엇보다 낯설지만 맛있음  뱅쇼와 올리브유의 조합도 맛있고 샐러드이 올리브유 넣어 먹어도 맛있음",음식이 맛있어요,재료가 신선해요,특별한 메뉴가 있어요
리정원 대흥점,,"육류,고기요리",,"숙성 갈매기살과 3000번 칼집을 낸 꽃삼겹살 맛집이에요~!  꽃삼겹살은 확실히 일반 삼겹살과 달라요~ 식감이 좀 더 부드럽고 육즙도 풍부해서 넘 맛있었어요 :) 인기메뉴 1위인 이유가 있네요~ 갈매기살은 기름이 많지 않아 담백하면서 쫀득한 식감이에요~야채꼬치도 기본으로 1개 제공이에요~  기본 상차림이 한정식집처럼 상다리가 휘어지게 나와요~양념꽃게장은 따로 사가고 싶을만큼 맛있었어요~다양한 김치와 나물, 소스 등이 나와 가족과 외식하기 좋아요~  후식으로 돌솥밥도 꼭 주문하세요~ 이천 쌀밥처럼 윤기좔좔 입맛 살려주는 쌀밥으로 물 부어서 누룽지까지 구수하게 먹고왔어요~  매장이 넓어 쾌적하고 단체모임도 편할듯해요~고기질과 반찬 들이 신선하고 맛이 정갈해서 또 방문하고픈 곳이에요 :) / 동네에 새로 생겨서 드디어 와봤습니다🤗 일단 매장이 너무 깔끔하고 공간이 아늑합니다. 반찬도 알차게 나오고 기본 찬에 양념게장도 주셔요. 물도 옥수수차예요. 소스도 엄청 다양해서 좋아요. 고기는 다른 리뷰보고 꽃삼겹살 시켰는데 진심 너무 맛있어요🥺 미친미친 육즙 미쳤어요ㅜㅜㅜㅜ 계란찜은 제발 모두가 드셔야합니다. 밀도가 미쳤어요 츄릅 직원 분들도 친절하십니다🫶 감동 포인트가 한둘이 아니네요ㅜㅜ다음에 또 올게요 / 고기가 진짜 너무 부드럽고 맛있어요! 꽃삼겹살을 꼭 드셔보세요.... 그리구 반찬이 진짜 잘나와서 고사리랑 파김치랑 파채랑 김치찜이랑 양념게장이랑 환상ㅜㅠㅠㅠ 고기먹고싶다 하면 꼭 찾아오는 집이예요! 너무 맛있습니다ㅎㅎㅎ 번창하시고 꼭 오래오래 해주세요:)!! / 먼저 반찬이 너무 잘나와서 놀랐는데 고기 질이 좋았고 종류가 많아서 너무너무 맛있게 먹었어요!! 가족들과 함께 저녁 먹으러 나왔는데 그냥 십겹살이 아니라 칼집이 나져있어서 육즙이 다 베어잇엇다는 !! 너무 만족스러워서 담에두 또 오고싶네요 ❤️ / 대흥역에 있는 경의선숲길 고기집 리정원 대흥직영점! 오픈한지 얼마 안됐는데도 웨이팅 하는덴 이유가 있죠😆 인테리어는 물론 정갈한 반찬, 맛있는 고기와 사이드메뉴까지 머무르는 내내 만족스러웠던 식당입니다☺️ 깔끔하고 맛있는 한식당, 고기집 찾으신다면 추천해요🫶💓 / 새롭게 생긴 것 같아 처음 방문했어요~ 일단 반찬으로 김치전이랄 양념개장이 포한되어 있어서 좋았어요. 고기는 직접 구워먹는데, 올려주시면서 소스 설명이랑 맛있게 먹는 방법 알려주셔서 좋네요~best 메뉴 꽃삼겹살 시켰습니다! / 시설은 오픈한 지 얼마 안 되어 깔끔했어요. 고기랑 반찬도 맛있구요. 냉면에 까다로운 아이가 냉면도 맛있다고 하네요.  홀에 여직원분 너무 친절하시고 일 너무 잘하시는데  인력이 부족해서 너무 바빠보여서 안쓰러울 정도였어요. 그래서 서비스가 바로바로 되지 않아 불편했습니다.ㅜㅜ 직원수를 늘리셔야 할 것 같네요. / 고기 맛집 리정원에서 점심특선 먹었네요 고기 듬뿍 두루치기와 김치찜 먹었는데 고기가 정말 맛나더라구요 여긴 정말 고기 먹으러 저녁에 다시 와야겠어요 두툼한 고기가 정말 육즙 가득 맛있어서 잘 먹었구요 밥도 솥밥 나와 정말 맛나게 잘 먹었답니당~^^ / 고기 야들야들하구 너무 맛있어요 퀄리티 너무 좋고 찌개의 칼칼한 맛이 대박입니당 고기랑 조합 너무 좋아요! 찬두 많구 분위기도 좋아서 추천! / 친구랑 놀다가 경의선숲길 근처 맛있는 고깃집이라는 리정원 갔다왔어요! 웨이팅이 조금 있었지만 웨이팅을 감수할 정도로 고기가 너무 맛있었어요🥹🥹 그리고 식사로 먹은 치즈뚝배기밥도 다른 데선 먹을 수 없는 특별한 볶음밥? 이어서 너무 좋았어요 ㅠㅠㅠ",음식이 맛있어요,고기 질이 좋아요,인테리어가 멋져요
명물화로,,"육류,고기요리",,"신촌세브란스병원 인근에 있어서 경의선 신촌역하고는 가깝고 2호선에서는 좀 거리가있네요. 숯불에 구워먹는 곳인데 숯불이 엄청 쎄서 고기도 잘익고 좋았네요. 여러부위를 다 먹을수있는 모둠으로 먹었는데 고기도 부드럽고 야채구이도 맛있었어요. 반찬들도 고기와 잘 어울려서 좋았고 파무침이 맛있었네요. / 신촌 고기집 명물화로는 다른 곳과 다르게 이색적인 인테리어와  고기를 다채롭게 즐길 수 있는 곳입니다 매장도 넓어 단체 모임 및 신촌에서 회식하기 좋아요 / 신촌 새로생긴 고기집! 외부인테리어가 시선끌어서 들어왔는데 5만원 한판 500g 이라 2인분으로 양 넉넉하고 고기질 좋아요. 맛있고 직원분들이 다구워주셔서 좋아요~ 습한 날씨라 고기집 걱정했지만 추울정도로 에어컨 빵빵해요:) / 지난번에 먹고 맛있어서 다시 방문했어요! 고기가 진짜 맛있어요😆 대학동기모임이라 중간지역이라 신촌에서 항상 만나는데 1차로 자주 올것같아요! / 집근처 고기집이 새로 생겨서 퇴근후 가봤는데 정말 맛있네요!!❤️😀 같이나오는 반찬들도 맛있고, 고기도 구워주시고 매장이 깨끗해요!! 가브리살, 항정살, 삼겹살 이렇게 먹었는데 정말 맛있어요!! 집근처라 이제 돼지고기먹고싶을땐 항상 여기로 갈래요😍 / 현대식 건물 안에 숨겨진 옛 저자거리를 모티브로 한 공간은 보고 있으면서도 비현실적인 멋스러움이 그대로 느껴질 만큼 시선을 압도했습니다. 그러한 공간 구성 덕분에 주방을 제외한 모든 곳이 오픈되어 있는 덕분에 고기 숙성고는 물론 고기를 손질하는 모습까지 그대로 보였는데, 음식이 나오기 전부터 믿음이 생기는 느낌이랄까요!  푸짐한 반찬과 양념장이 먼저 깔리고, 감사하게도 고기는 가장 맛있는 굽기로 직접 구워주셨는데 그냥 먹는 그 맛 자체가 너무 담백하게 맛있었습니다. 여러 양념 중 표고와사비와의 조합은 색달랐는데, 계속 그 맛을 보게끔 만들어주는 기분! 네이버예약 시 제공되는 달래된장찌개는 된장의 구수함과 달래의 신선함이 어우러져 또 다른 감동을 느끼게 해주었습니다! / 인테리어도 너무 멋지고, 고기 퀄리티도 좋네요!! 직원분들도 친절하셔서 좋은 모임 시간 가지고 갑니다 ㅎㅎ 소스도 다양해서 같이 먹기 좋아요! / 여기 가브리살 진짜 찐해요 소스랑 조합두 좋구 파채에 무가들어있는데 식감도 너무좋구 맛있네요☺️ / 고기가 완전 맛있고 두꺼워요 !! 직원분들도 친절하시고 재방문의사 ⭐️⭐️⭐️⭐️⭐️ / 고기도 직접 다 구워주시고 넘 맛있게 잘 먹었습니다! 직원분들도 친절하시고 인테리어도 훌륭하네요! 담에 또 올게요 ^^",음식이 맛있어요,고기 질이 좋아요,친절해요
호밀밭,4.61,카페,신촌사이 알흠답게 맛있는 빙수집,"팥을 진짜 만드시는거같아요! 사실 우유빙수 베이스은 너무 달고 우유랑 물 섞은맛이라 별로였는데 팥은 맛잇엇어요~ 맛 보다는 가성비 빙수집인듯! / 커플 디저트로 1빙수 1치즈케이크 괜찮았어요👍👍 팥 알이 엄청 살아있는 편인데 저희는 '크게 상관없다'vs'아니다 더 뭉개져야 한다'로 재밌게 옥신각신했네요🤭🤭 / 오랜만에 가보니 신메뉴 흑임자빙수가 나왔습니다. 미니약과 위에 팥과 떡을 얹어 빙수와 같이 먹으니 고소달콤시원 맛있습니다. / 아니 빙수가 이렇게 맛잇을일 있능거임?!  럴수 럴수 이럴수가!  그야말로 문화충격~~~ ･̀ㅂ･́)/ / 오랜만에 방문했는데 여전히 팥이 탱탱하고 떡도 너무 맛있고 좋아요. 그리고 티 시켰는데 차가운거 먹고 마시니 좋았어요 / 만삭사진 촬영 후 팥빙수 먹는다고 신촌으로..ㅎㅎ  곱게 갈린 우유얼음에  적당히 달달하고 오동통한 단팥 조화가 아주 좋네요~  주차는 신촌역 옆 공영주차장에 하면되고, 1회에 한해서 팥과 떡이 무료리필 가능합니다.  팥빙수 좋아하면 추천추천!! / 워낙 명소인데 드디어 방문했습니다  역시 명불허전 이네요 밀크빙수 특히 강추입니다 입자가 너무곱고 팥도 부담없이 너무 맛나더라구요 가격대도 아주 좋아요 / 말차맛 밋있어요! 말차랑 팥이 찰떡궁합이다! 다음에 흑임자맛 먹어봐야 겠당~ / 가성비 좋고 맛있어요 사람이 항상 넘쳐나네요 / 녹차 덕후라 방문했어요. 빙수도 토핑도 군더더기 없이 깔끔한 맛이에요! 혼자 먹기엔 좀 많았어요!🥶 부드럽고 맛있습니다! 달지 않아 좋은 것 같아요!",디저트가 맛있어요,특별한 메뉴가 있어요,가성비가 좋아요
스페인식당 더크래프트,4.76,스페인음식,,"해산물 요리의 끝판왕...꿀대구 요리는 대구살이 촉촉하면서 단백하고 소스에 꿀맛이 같이 어우려져 생선이랑 안친한 저에게 신선한 충격:) 음식 자체가 신선해서 해산물 좋아하시는뷴들 강추 가볍게 와인이나 맥주 데이트 하기 너무 좋아요❤️❤️ / 원래도 자주 찾던 맛집인데 리뉴얼하면서 새로운 메뉴들이 정말 특별합니다. 맛도 좋은데 예쁘기까지 한 메뉴 라 자꾸 시키게 되네요 :) 장사천재백사장에서 나온 핀초 메뉴와 차콜리까지 준비돼있어 이국적인 분위기가 물씬 나네요!! / 좋아하던 집이 다시 오픈했네요!!  스페인에 이어 평일 낮엔 제주 돼지 곰탕을 팔아요!!  저녁에 스페인 요리 만들면서 만들게 되었다고 블라블라~~  그냥 맛있어요! 옥동식보다 훠월씬~~~ 이집 찐이네요.  조만간 줄 설듯 … 배달도 하시는것 같던데 .. 부모님 생각나는 건강한 맛입니다. 건강한데 맛있다는 ~~~ 사장님 자주 봐요~~~저녁에도 이번 주말 런치 메뉴델디아? 도 가족들과 올게요~~제발 기억 좀해줘요~~~~ 개걸스럽게 먹느라 곰탕 사진을 ㅋㅋㅋ 못찍🥲 / 드디어 오픈을 했네요. 아 기다리고 기다리던 … 동네 맛집.  새로운 스타일 넘 힙해요!! 아현동 업그레이드 느낌 !!  핀초바 라니 바르셀로나가 따로 없네요!! 오늘은 맛만 봤지만 조만간 또 옵니다!! 빨리 와인 준비해 주세요~~~~~ / 아현동에도 드디어 돼지곰탕이!! 합정동까지 늘 다녔는데 이젠 그럴일 없겠네요. 낮엔 제주도 저녁엔 스페인 넘 신선하다 생각했는데 와서 먹어보니 알겠네요. 덥지만 몸보신 잘 하고 가요!!  믿고 먹는 점심 집이 생겨 너무 좋습니다. / 지나가는 길에 특이한 컨셉의 음식점이라 방문했습니다 돼지곰탕이라는 메뉴가 신선했고 맛도 깔끔하고 너무 맛있게 먹었습니다  그리고 가게 직원분들및 사장님께서 너무친절하시고 물어보는거에 성심성의껏 대답해주시는 모습이 너무 감사했습니다.  스페인 음식점이라는 곳이 아직은 좀 낯설지만 한번 여기서 걍험해보시면 그 매력에 빠져 금방 단골이 될것같네요 / 몇년만에 온 더크레프트. 시즌 1,2에도 왔었지만 그때의 맛을 기억하시는 독자님들이라면 꼭 다시 와봐야 하는 수준으로 업그레이드 되었어요!  수준 높은 스페인 요리를 이 가격에 한국에서 맛본다는 것은 여기가 아니면 불가능할 것이에요!!!  천정부지로 물가가 오른 한국에서 최상위 퀄리티의 핀초스와 이 수준의 와인을 이 가격에 마신다는 것은??   무작정 한국물가가 인상되었다며 가격부터 올리고 보는 한국 여타 식당(특히 말도 안되는 가격의 야장가게+포차들) 반성좀 하세용♡♡  대박나세요♡ 넘 행복하게 먹고 갑니다 ●●뽈보와 15번 꼭 드세요!!!!!!!!! / 너무 맛있었어요. 원래 리뷰 잘 안남기는데  신혼여행으로 간 포르투에 뽈뽀가 먹고 싶어서 갔는데 포르투에서 먹은거 보다 신경써서 만든 음식 느낌이고 맛도 좋고 분위기도 너무 좋았습니다.  그리고 사장님이 정말 신경쓰시는게 눈에 보입니다. 꼭 한번 가보세요  가끔 그때의 좋은 기억을 상기하러 가겠습니다. / 스페인 온 것 같고 좋아요 / 맛있고 독특한메뉴들많아요 하지만 양대비조금 비쌉니다^^;",음식이 맛있어요,특별한 메뉴가 있어요,인테리어가 멋져요
