name,rating,type,descript,reviews,keyword1,keyword2,keyword3
꾸아 이대점,,베트남음식,,"타 베트남 음식 식당과는 다른 쌀국수 맛이 나요! 일단 매장 분위기도 힙하구 오픈한지 얼마 안돼기도 했고 대체로 깨끗하다는 느낌이 납니다.  일단 자리 안내와 설명부터 해주시는데, 음식 주문 결제는 키오스크로 가능하구 분할결제도 가능하게 되어있어요.  음식은 15분도 안 걸려서 나온것 같아요! 한우사골직화쌀국수로 시켰는데, 고기에서 불향이 나구 퓨전 스타일로 맛있게 먹었습니다.  개인적으로 볶음밥도 맛있긴했는데, 쌀국수를 더 추천합니다..!  다음에도 점심 먹으러 올것 같아요! 맛있게 먹구 갑니다! / 제발.. 너무 맛있어요... 저 쌀국수를 안좋아하는 사람인데요... 여기 왠지 맛나보여서 걍 들어왔는데 진짜 대성공... 작년 베트남에서 먹었던 분짜 쌀국수보다 백배 맛있어요... 제발 여기 모르는 사람 없게 해주세요....제발 내돈내산이에여ㅠㅠ 진짜 / 새로 오픈하는 매장이라 기대하면서 방문했어요✨ 우선 직원분들이 너무 너무 너무 정말 친절하셔서 내내 불편함 없이 즐겁게 식사할 수 있었습니다!  메뉴도 다양하고 맛있고 밑반찬이나 면 추가 등이 키오스크로 자유로워 부담없이 즐길 수 있었어요!!🥰🫶🏻 특히 볶음밥 너무 맛있었는데 뭔가 땅콩맛도 나고 숙주와의 조화가 너무 맛있었어요 다른 메뉴도 말해모해…🤤🤍 지인들과 모임을 위해 방문했는데 점심 혼밥도 완전 가능할듯한 분위기였습니다!! 다른 메뉴들도 도전하고 싶어 재방문 의사 완전!! 있습니다 ㅎㅎ  좋은 분위기에서 식사 잘했습니다. 감사해요!!😙💚 / 애인 추천으로 와봤는데 매장이 깔끔하고 넓어서 좋았어요! 주문은 테이블 개별 키오스크로 가능하고 카드리더기도 있어 바로 결제가 가능합니다 바쁜 학생들이 이용하기 아주 좋을 것 같아요. 맛도 정말 좋아요!!! / 매장 오픈 초반이고, 이대 방학이라서 줄서야 되는 식당을 여유있게 들어가서 먹고 나왔네요.현지 느낌 매장 인테리어도 예쁘고, 금속 컨셉 가구류와 스테인리스 스틸 식기류도 잘 어울립니다. 음식은 당연히 맛있습니다. 퍼보 같은 경우는 한국화가 안되어서 좋네요. 다른 식당들과 달리 탱글탱글한 면에 불맛입힌 차돌박이가 잔뜩 들어있습니다. 국물도 현지스러운 진국이고, 파가 가득 올려져 있습니다. 반세오도 맛있긴 한데, 싸먹기가 너무 귀찮아서 다음에는 분짜 먹어야겠네요.^^;; 또 와서 다른 거 먹어보려구요. / 꾸아이대점 오픈하기를 기다렸는데, 기대이상임. 매장도 크고 직원분들 친절도도 좋음. 쌀국수 국물은 갈비탕처럼 감칠맛 나고,양파절임에 스리라차+해선장 같이 먹으면 느끼함도 싹잡아줘서 술술들어감. 오픈이벤트로 저렴하게먹었는데 나중에는 정가주고도 먹으러 올것 같음. / 이대에서 쌀국수 최강자가 될것 같아요 양파절임 직접 담그신다고 하셨고 메인메뉴들 아무 양념안해도 진하게 맛있어요 / 꾸아 원래부터 오고 싶었는데, 근처에 매장이 없어서 아쉬웠는데 이대에 생겨서 너무 좋아요^^ 쌀국수 국물 맛이 찐이에요!!!! 너무 맛있어요!!♡ 쌀국수 너무 좋아하는데 매장도 넓은 쌀국수 맛집이 생겨서 앞으로 가족들과 자주 올 것 같아요:) / 맛있어요!! 레몬, 고수, 양파절임 등도 자유롭게 추가할 수 있어서 다양하게 맛볼 수 있고, 면추가도 무료라 양 많이 드시는 분들은 좋겠네요ㅎㅎ 직원분들이 무척 친절해서 인상 깊네용 / 정말 맛있어요! 쌀국사가 훈제한 맛이에요!! 고도 부드럽고 귝물이 깊은 맛있는 쌀국수입니다! 볶음밥도 땅콩향이 강해 고소해요! 추천합니다~~",음식이 맛있어요,매장이 넓어요,인테리어가 멋져요
머스타드,,카페,,"처음 방문했을 때 나폴리탄 시키고, 진짜 맛있어서 식욕 올라서 시금치 오믈렛까지 시키고 혼자 다 먹었어요😂 두 번째 방문했을 땐 치즈 토스트와 커피 두 잔을 주문했습니다. 두 번의 경험 모두 제겐 정말 좋은 기억입니다. 다음 번도 다다음 번의 방문도 기대됩니다🥰 / 라떼가 특히 맛있는 머스타드! 음료만 있는 카페인줄 알았는데 브런치 메뉴가 보여서 예약하고 다녀왔어요.  나폴리탄 소스의 감칠맛도 너무 좋고 소세지, 브로콜리, 버섯 등 재료도 풍성해서 너무너무 맛있게 먹었습니다-! 사장님도 친절하시구요🐻 귀여운 도순이가 그날은 안보여서 쪼꼼 아쉬웠지만..🫢 다른 브런치 메뉴도 궁금해서 자주자주 가게 될 것 같아요 :) / 너무 맛있고 신선하고 친절하시고 아지트 같은 아늑한 곳이에요!!😋🎀 담에는 도순이를 볼 수 있길🐶🦴 / 예약생겨서 너무 좋아요!!ㅋㅋㅋ 푸짐하게 먹었습니다.굴라쉬는 해장용으로도 굿…👍🏻 밥 다먹고 커피까지 먹으니까 아주 완벽한 한끼였습니다 방문하시는 분들 후식으로 커피도 꼭 드세요^_^! 다음에 또 예약해서 방문예정..😆 / 굴라쉬 헝가리에서 먹었던 것 보다 제 입맛에 맞고 맛있었어요 그리고 레모네이드가 생각보다 너무 좋았어요 레몬청 아니고 레몬 직접 들어가서 상큼한 맛!! 강아지도 너무 예쁘고 얌전해요 다른 메뉴도 먹어보고 싶네요 / 모닝플래터라는 주말메뉴가 보이길래 나폴리탄과 함께 주문했어요! 맛있는거 먹고 주말근무 힘내서 하려고 머스타드 간건데..  사장님 이거 왜애.. 주말에만 하세요..? 평일에도 해주시면 신나게 먹을 것 같은데요..!!🍑🍑 이거 먹으려면 주말에 또 회사 와야….ㅎㅎ  모닝플래터 각각의 재료 조합이 신선했는데, 생각보다 같이 먹는 맛이 잘 어울리고 너무 좋았어요! 시금치..가 볶으면 원래 이렇게 맛있나? 생각했어요 ㅎㅎ 주말에 가시는 분들 꼭 드셔보세요! / 카페 상주견을 볼 겸 겸사겸사 갔는데, 그 날은 퇴근하고 없다고 하더라구요. 덕분에 맛잇는 굴라쉬맛 먹고 갔어요 ㅎㅎ  굴라쉬가 먼지도 모르고 시켰다가 꽂힌 동행인 분 덕분에 조만간 한번 더 가지 않을까 싶어요. 비록 느려도 맛있는 음식이 나온다면 대만족이에요 :) 번창하세요! / 시금치 오믈렛이 부드럽고 촉촉하고 너무 맛있었어요🫶 흔한 메뉴가 아니어서 더 좋았고, 같이 나온 소스도 함께 먹으니 더 맛있었습니당ㅎㅎ 원두도 직접 로스팅 하신다고 하셨는데, 최근에 마신 아메리카노 중에 최고😊 귀여운 도순이도 보고 브런치도 먹고 행복…. 다음에는 다른 메뉴 도전하러 갑니다! / 서울에서 맛있는 커피 3위안에 듭니다!  플랫화이트 드셔보세요 ㅠㅠ  브런치도 커피와 너무 조화로워요 집 근처라 자주 가는데  모든 친구들이 맛있다고 인정했어용! / 이대역 커피, 브런치 맛집이에요~ 사장님도 너무 친절하시고 머스타드 마스코트 도도한 도순이를 보고만 있어도 힐링이 됩니다🥰",친절해요,커피가 맛있어요,특별한 메뉴가 있어요
나이스워크투데이,,"카페,디저트",,"라떼 맛있어요! 그리고 작업하거나 공부하기 좋아요 평일 낮에 갔는데 자리 다 차있었어요 가을에 테라스쪽에 앉고싶어요 / 공덕역부터 숲길 슬슬 걷다보니 이쁜 카페가 있어서 들어오게되었는데 숲길이 보이게 탁 트여있어서 정말 좋더라구요~ 실내인데도 답답하지 않았고 씨브리즈티랑 아아 그루브원두로 마셨는데 음료도 만족스러웠어요! 휘낭시에는 쏘쏘했습니당 :) 매장직원들도 친절하시고 대흥역카페로 추천드릴게요 여유롭고 좋았습니다~☺️👍 / 추천 받아서 간 나이스워크투데이💻📖  평일 오전에 가니까 아직 자리 많았고, 숲길이 내려다보이는 테라스 자리에 앉았는데 흐려서 그런지 눈도 안 부시고 바람 솔솔 불어서 땃 ! 좋았어요  필터커피 따시게 시키고 플레인휘낭시에 주문했고, 바리스타님이 친절하게 가져다 주셨어요.😊  커피는 따뜻할 때는 편안하게 마시기 좋았고 식으면서 점점 베리맛 톡톡 튀어서 재밌었어요 휘낭시에는 겉빠!속쵹 꾸덕~했고 많이 달지 않아서 커피랑 페어링하기 좋았어요 잘 어울리는 한 쌍!!!!!!!  혼자 오셔서 작업이나 독서하시는 분들이 많아서 이런 분위기 좋아하시는 분들 좋으실 것 같아요! 저도 앉아서 혼자 책 읽다가 왔어요 좋았습니다🖤 / 일단 뷰가 너무 좋습니다 ㅎㅎ 초록초록한 뷰를 보니 저절로 기분이 좋아지네용 커피도 맛있고 작업하기 좋은 공간인 것 같아요 :) / 경릐선숲길 바로 옆에 위치해 잠시 들러 창밖보며 커피 한잔의 여유를 즐기기 딱 좋아요 / 햇살도 잘 들어오고, 테이블 간격이 조금 좁지만 봄 되면 인기가 더 많아지겠네요. / 커피 주문 시 두 종류의 원두 중에 하나를 선택할 수 있는데 둘 다 개성이 뚜렷하고 맛있었습니다. 숲길 쪽으로 전망도 좋고 층고가 높아서 실내도 상당히 밝은 분위기였구요. 다만 손님이 많아서 경우에 따라서는 다른 손님과 합석해야 되는 경우도 있습니다. / 커피도 맛있고 요즘 날씨에 가서 작업하기 딱 좋았어요. 학교 근처라 그런지 평일에도 사람이 많았어요!! / 설연휴 간만에 서울 동생네에 모짐 나를 포함 4형제자매가 다 모인것 처음인듯 아빠가 좋아하심~~~^^ 맛있는 저녁을 먹고 집주변산책 ᆢ  따뜻한 커피 차한잔 ᆢ 주인아저씨가 친철하고 창밖뷰가 예쁨 서비스로 맛있는 휘낭시에 주심 ᆢ 이런시간이 참좋음~~^ 비행기타고 전철타고 힘들었는데 ᆢ급 소확행~~ / 뷰도 좋고 몽블랑도 맛나고... 인테리어도 좋네요",커피가 맛있어요,집중하기 좋아요,뷰가 좋아요
능소니씨,,생선회,,"맛있어요 손님 왔을때 같이 가기 좋아요 / 지나가면서 항상 궁금했던 곳.예약 후 방문해야 합니다~재료도 신선하고 맛있었어요~사장님도 너무 친절하시고 재방문 하고 싶은 능소니씨!!!! / 아현시장 숨어있지만 유명한 맛집. 막회, 모듬 우니해산물, 어묵탕 먹음. 신선한 해산물부터 다양한 요리까지. 혼자서 운영하시는데도 음식 금방 척척 나옴, 예약 어렵고, 자리 협소해도 이 가격에 너무 맛나고 고급진 메뉴들 생각나서 자주가게됨. 예약제, 포장가능!!! / 우리동네보물 / 좋은음식,좋은사람과 좋은시간 보냈습니다. 예약하고 이용했는데 제가 방문한 날만 그런지 몰라도 예약없이는 거의 이용 불가능해보이더라구요. 다른메뉴때문에 재방문 할 것 같은데 후토마끼는 또 주문할 것 같네요. 방문시점엔 후토마끼는 예약해야지만 가능했는데 예약하실때 후토마끼 꼭 예약하세요..! / 죽은 아현시장 숨은 맛집입니다 재방문의사 1000% / 늘 사람이 많아서 예약 후 갈 수 있는데 이 날은 운좋게 자리가 있어서 4명자리에 앉았어요. 능소니씨 오면 꼭 시키는 막회와 후토마끼 반줄 그리고 알탕 주문 했어요. 막회는 언제 먹어도 맛있고 후토마끼가 진짜 맛있네요!! 다음에 가면 후토마끼는 꼭 시킬려구요. 알탕도 얼큰하니 조개와 곤이, 알 듬뿍 들어가 있어서 밥이 생각나는 메뉴 였어요. 국물이 넘 맛있네요. 핸드릭스 진도 오이와 레몬이 들어가서 오이향 솔솔 나는게 본술 마시기전 에피타이져로 한잔 하기 딱 좋아요. 분위기도 좋고 안주도 맛있어서 매일 가고 싶어요 ㅎㅎ / 동네에 분위기 좋은 술집~ 음식들도 다 맛있고 사장님도 친절해요. 막회가 신선하고 초장도 넘 맛있어요!! 조개탕도 국물이 시원하고 깔끔해서 술 마시면서 해장하는 기분이에요. 조개탕 먹고 라면 추가 해서 먹었는데!! 최근 먹은 라면 중에 최고였어요!! / 해산물이 정말 싱싱해요! 매장은 협소하나 예약하고 가니 편했고 또 방문하고 싶어요😊 단새우에 우니 회까지 조합이 너무 제 스타일이에요🤍 조개탕도 달큰해요! / 이쪽으로 이사와서 여기저기 술집 격파중인데 능소니씨 ,,,💗 완전합격입니다🥹🥹💗💗💗💗  가게 시스템을 잘 몰라서 일단 리뷰만 보고 전날 예약하구 메뉴까지 미리 주문해놓고 가니 전 완전 대만족 ㅠ  음식도 빨리 나오고 사장님까지 친절❣️  가실분들은 꼭 미리 주문하고 늦지 않게 방문하시면 빨리 받으실 수 있을거에용 !  딱새우는 최소3일전엔 미리 예약을 하고 가세용 !!  저두 몰라서 단새우먹었는데 단새우 뮏친 ㅠ 대존맛❣️❣️  그냥 다 맛있을거같아요 여긴,,,,✨💛 또갈게요 사장님 ㅠ❣️",음식이 맛있어요,재료가 신선해요,특별한 메뉴가 있어요
모미지식당,4.75,한식,,"❥ menu : 육회덮밥 (11,000)  ❥ 모미지식당에서 저는 육회덮밥만 먹어요. 육회가 질기지 않고 부드러워요. 밥이랑 같이 먹으면 짜지도 않고 간도 딱 좋아요 ♡ 이대 맛집 인정 ♡   ❥ 셀프바에 있는 파인애플은 설탕뿌린 것처럼 항상 달달하고 맛있어요! 그리고 샐러드도 장국도 맛있어서 그냥 완벽하다는 생각밖에 안 듭니다..   ❥ 테이블마다 키오스크가 있고 분할 계산이 돼서 친구랑 갔을 때도 각자 계산하기 편해요 !   방학때도 자주 갈게요 ~ / 가게 외관상으로는  모르겠지만 리뷰 평점이 높아서  가보았던 모미지 식당   왜 평점이 높은지 요소들이 보였다. 1.직접 이용할 수 있는 반찬+장국 셀프바  2.혼밥+ 데이트 하기 좋은 분위기 + 자리마다 주문용 테이블 있음(선불결제)   3. 음식 자체가 맛있고 목넘김이 편안한 음식들   육회덮밥 = 육회가 질기지 않고 잡내 안나며 노른자 터트려서 밥이랑 먹기 좋음 + 느끼하면 와사비 사알짝 곁들여 먹기  소고기가지덮밥 = 가지가 거슬리게 씹히지 않고 고기와 부드럽게 씹힘 + 김치/단무지 와 함께 하기 좋음  모듬 고로케 = 야채+고구마치즈+카레 조합으로 잘 찾을 것 같은 세가지 조합으로 해둠  샐러드 = 흑임자 드레싱으로 위의 음식들과 잘 어울림  장국 = 미소장국 인데 시큼한 맛이 안남(고소+담백) / 진짜 맛있습니다 음식도 주문하면 바로바로 나옵니다 그리고 시그니쳐 소고기가지덮밥은 진짜 강추입니다 / 가지덮밥 전문으로 하는 곳이라 방문해봤는데 벌써 3번째 방문하고 드디어 후기남깁니다 정말 너무 맛있어요 육회덮밥도 맛있지만 저는 불가지덮밥이 젤 맛있습니다 / 이대생이라면 모두가 아는 맛집이죠ㅎㅎㅎ 육회덮밥 늘 맛있어요! 타대생 친구나 손님 데려오기도 깔끔하고 좋은 식당입니다 추천드려요 / 점심식사로 맛있네요. ^^ / 이대 유명 식당… 점심시간에는 꿈도 못 꿨는데 방학이니 바로 먹을 수 있었어요. 다만 육회 비빔밥이랑 냉모밀 세트도 나왔으면 좋겠어요🥲 / 육회 비빔밥 먹었는데 양이 진짜 많아요! 일반은 11000원이고 곱빼기는 15000원인데 곱빼기는 양이 진짜 많아서 남겼어요.. 중대식가 기준 일반도 양이 많은 편입니다:) / 월요일 11시 맞춰서 갔더니 대기 없는 거의 마지막 팀이었어요 바로 웨이팅 생기더라구요..! 가지덮밥 불가지덮밥 둘다 맛있어요ㅎㅎ적어보였는데 먹다보니 양 많아요👍👍 / 혼밥하기 좋고 샐러드랑 파인애플 계속 가져다 먹을 수 있어서 좋아요! 밥양도 적당했고 육회도 너무 맛있었어요",음식이 맛있어요,친절해요,혼밥하기 좋아요
참참참,4.62,한식,농림축산식품부 제공 안심식당,"많은 식당들이 3시에 브레이크 타임을 해서 밥을 먹기 엄 힘들었는데 다행히 여기는 운영합니다. 음식이 너무 맛있습니다. 반찬도 6가지 제공합니다. 기본 반찬인데 신선하고 맛있습니다. 가성비가 너무 좋은 집입니다. / 좀 짜지만 김치제육 혼밥 편하게 했어요!👍🏻 / 양도 많고 기본 찬이 다양해서 좋아요 너무 맛있어서 울면서 먹었어요 / 좀 짜요 / 위생, 맛 최악입니다  제육 시켰는데 일단 음식이 너무 짜요..ㅠ 맛 최악..  콩나물 밑반찬에서 휴지조각이 발견되서  사람이 하는 일이라 그럴 수 있겠거니 그냥 반찬 바꿔달라고 조용히 말씀 드렸는데.. 그 자리에서 콩나물을 손으로 뭉개시면서 휴지조각을 콩나물 껍질이라며 증거인멸....변명만 하셨습니다  아니 음식에 실수로 휴지 들어갈 수 있죠..  누가봐도 휴지를 콩나물 껍질이라는 거짓말에..  ㅠㅠ 손으로 음식을 보는 앞에서 뭉개버리시는 바람에  저도 친구도 비위가 넘 상해서 음식 절반 이상 남았음에도 불구하고 다 남기고 나왔습니다...ㅠㅠ 뭐가 맛있단건지 모르겠어요 msg 폭팔맛 / 김치찌개 오징어 볶음 먹었어요 집밥느낌 맛나요:) / 너무 맛있어서 깜짝 놀랐어요..! 순두부찌개 뭐 그냥 평범하겠지 생각하고 갔는데 이런 순두부찌개는 처음 먹어봤어요. 뭔가 참기름 맛이 좀 나는데 참기름 좋아해서 좋았고 외식으로 먹는 그런 찐하고 짠 순두부찌개가 아니라 되게 건강한 맛.. 건강한데 맛있는 맛!! 돌솥이라 완전 따끈따끈해서 먹으면서 행복했어요..... 앞으로 자주 갈 것 같아요! / 김치제육이 진짜 너무 맛있었어요!!! 저는 밥보다 반찬을 많이 먹는데 반찬이 6가지나 되서 좋았습니다ㅎㅎ 남자사장님?도 친절하시고 근처에 다시 갈일이 있다면 재방문의사 있습니다. / 참참참 순두부찌개에 중독.. 제육이랑 돌솥 먹어보고싶은데 혼자 오면 항상 순두부찌개를 놓칠 수 없어서 순두부찌개를 시켜요ㅋㅋ / 순두부찌개 짱짱짱 맛있어요!! 다음에는 제육볶음이나 돌솥 시도해보려구요",음식이 맛있어요,혼밥하기 좋아요,친절해요
편백집 아현점,4.45,"육류,고기요리",소고기 편백찜이 맛있는 편백집,"고기와 야채 위주 건강식 찾아 먹으러 갔어요. 밥, 탕 류도 있어서 곁들여 먹기 좋았습니다. 자주 갈것 같아요. / 반찬도 맛있고 정갈하게 나와서 눈도 맛도 즐거워요^^ / 맛나고 좋아요 / 양이 좀 작지만~맛있어요~~ / 반찬 정갈하고 맛있어요. 찜도 맛있는데 양은 적어요! 가볍게 먹으러 갔는데 계속 식사는 따로 시키셔야해요라고 여러번 강요(?) 받아서 8천원짜리 덮밥 시켰는데 날계란밥수준..낙지 극소량ㅎㅎ2,3천원에 파는 사이드 메뉴 수준이었슴당 / 아이가 좋아해서 가는곳인데 엄마아빠가 과식하는곳이에요 편백찜 건강에 좋고 담백하고 든든하니 맛있어서 좋구요 여기에 같이 곁들여 먹을 음식이죵 묵은지어묵탕 이거 얼큰하니 너무 맛있어요 김치도 맛있는데 안에 어묵 너무 맛나서 저희는 가면 꼭 찾네요 간장새우밥을 튼곳! 새우장 맛있다고 맛나게 먹고 낙지장은 포장해서 담날 계란에 비벼주니 한그릇 뚝딱하네요. 반찬으로 나오는 음식들도 맛있고 친절하신 사장님들 바쁘셔도 항상 리필 잘해주셔서 감사합니다  저녁시간에 조금 늦으면 항상 기다려야하는지라 편백찜 가는날은 저녁 일찍 먹는편이에요 / 음식이 맛잇어요 친절해요 / 늘 사람 많고 맛있어요 / 담백하고 깔끔한 편백~ 한라산도 있네요~ㅎ / 단골 많고 깔끔 친절한 동네 맛집 같은 분위기에요! 소고기편백찜 & 간장새우밥 조합이 기본인가봐요~ 건강하게 잘 먹었습니다!",음식이 맛있어요,친절해요,특별한 메뉴가 있어요
고든베넷,4.65,"카페,디저트",,"아이생일파티 준비하다 알게되었어요 집에서 멀지 않은곳에 이렇게 귀여운 컵케익샵이 있다니… 너무 좋네요!!! 앞으로도 종종 이용할꺼같아요! 저도 먹어보고싶어서 따로 4종류 더 주문해봤는데 많이 달지않고 깔끔하니 맛있네요!!! 아이들 먹이기에 너무 좋은거 같아요 미리 결제후 전화로 드라이브스루로 받는것도 정말 편리하고 좋았습니다!!!! / 일욜 점심 행사라, 토욜 오후 5:40분 픽업으로 요청드렸는데, 일욜 오전에 직접 배송까지 해주셨습니다.  덕분에 행사 성료하였고, 아이들 부모님들 모두 맛있는 컵케익과 함께 행복한 시간 보냈습니다. 종종 주문드리겠습니다. 감사합니다! / 첫째 생일이라 유치원에서 컵케이크를 부탁하셨어요, 사장님께서 아이들 연령대에 맞추어 조언도 해주시고 당일 늦지않게 잘 만들어주셔서 즐거운 생일파티 하였네요! 감사합니다^^ / 역시나 컵케이크 너무 예뻐요 사장님이 오래오래 영업하셨으면 좋겠어요 컵케이크좋아해서 여러군데 가봤는데 이만한곳이 없는듯 / 굿 / 오랜만에 너무 맛있는 컵케익을 먹었어요! / 크리스마스 케익 대신 샀는데 넘 귀엽고 맛도 있어요. / 아이 생일이라 구매했는데  예쁘고 맛있고 넘나 최고예요!! / 맛있고 매장 깔끔해요 / 너무 이뻤어요~~ 사람들이 너무 이뻐서 어떻게 먹냐고 할 정도였고 맛도 좋았어요~ 다음에 또 구매할께요",디저트가 맛있어요,친절해요,특별한 메뉴가 있어요
아현동간장게장,4.24,게요리,애오개역 아현동에서 유레카 외친 서울 간장게장 맛집,"단점 : 간장게장 꽃게가 작아요. 기억에 남는 특별한 맛은 아니어서 외국인에게 왜 인기가 많은지 모르겠어요. 양념게장은 양념이 고추장 떡볶이 맛이 나서 호불호 있을듯 해요. 장점: 일본인 손님이 많아서 그런지 손님들이 조용히 도란도란 이야기합니다. 게장에서 비린내는 안 났어요. 게장 외 다른 식사메뉴가 많아서 그걸 시도 해 볼 수 있을 것 같아요. 다른 공덕 유명 게장집보단 저렴해요. / 임신했을때 양념게장이 너무 땡겨서 자주가던집!! 이사오고 2년만에 방문했는데 역시 맛은 변함없이 그대로네요♥  사장님도 친절하시고 모든게 최고입니다. / 늘 사람이 북적대서 오랫만에 포장 방문했는데 여전히 친절하시네요. 가격이 꾸준히 오르고 있지만 맛있어서 계속 갑니다~ / 요즘 꽃게게장집 가면 가격이 너무 비싼데 여기는 집반찬스타일에 실한 꽃게가 나와서 애정하는 가게 입니다. 오징어볶음은 아이가 먹을거라 맵지않게 부탁드려서 하얗게 나왔어요. 포장도 되니 설선물로 줘야겠어요 / 너무 잘 먹고 갑니다  오랜만에 와도 변하지 않은 맛  항상 감사합니다 ㅅ ㅅ ㅅ   발전하세요! / 굿 / 1인 27000원 인데, 한상 푸짐하게 나오길 기대했더니...... 다른 분식집보다도 기본 밥의 양도 꽉차있지.않고!!! 허술한.반찬에 꽃게 1마리 양도.. 생각보다 젹어서 너무~ 깜짝 놀랐어요!!!!!  게장은.밥도둑인데 기본 밥이 적어서 더 달라니까... 천원 받더라고요 이정도면 써비스로 줄 줄 알았더니ㅋ  암튼 총 28000원.. 사진에 저 정도 밥상.......ㅠ 너무 비싸네요!!! 주차도 안되고!!! 서울페이도 안되고..!!! 한국인 거의 없고..... 죄다 외국인 밖에........ㅋ / 포장가격이 조금만 더저렴하면... / 오랜만에 방문! 주차가 아쉽다 ㅠ / 간장게장과 양념게장이 아주 맛있고 살도 푸짐 철에가면 알이 들어있어 더욱 맛있네요  포장도 푸짐",음식이 맛있어요,친절해요,재료가 신선해요
