name,rating,type,descript,reviews,keyword1,keyword2,keyword3
아민 이화,4.62,양식,,"제법 더운날, 먼거리를 찾아간 보람이 가득한 날! 이곳을 콕! 찍은 저의 선택에 어깨가 으쓱해진 날! 처음 먹어보는 색다른 음식에 기대도 컸는데 그런 기대를 배이상 충족시켜준곳이에요~♡  뱅쇼에 올리브유를 2대 1로 섞어마시는 요거, 특이했구요~ 이쁘고 다양한 플레이팅에  제대로 대접받는 느낌이라 감동이었어용~^()^ 이 느낌 그대로 먹는내내 행복했습니다~ 모든 음식이 다 만족스러워서 가까운곳에 있다면 사랑하는 사람들 한번씩 다 데려가서 맛보여주고싶네용!!! 최고의 한끼!!!  직원분들도 너무 친절하셔서 이또한 재방문 하고픈 이유입니당~♡ / 처음 먹어보는 음식이라 맛있을지 어떨지 걱정되었는데 걱정이 무색할정도로 굉장히 맛있었어요! 뱅쇼랑 올리브유를 같이 섞은 식전주도 맛있고 새롭더라구요ㅎㅎ서빙해주시고 어떻게 먹는지 방법을 친절하게 설명해주셔서 그 점도 좋았습니다💓 / 결혼 후 15년만에 신촌 나들이 리뷰 보고 선택한 아민 이화 평상시 접하지 못한 음식이라  아이들의 호응을 받지는 못했지만 타국 음식 느끼고 싶을때 특별한 음식 먹고 싶을때 추천드려요 사장님께서 알려주시는대로 드셔 보세요 음식을 배로 즐길 수 있어요 / 작년에 방문후 재방문. 메뉴와 음식나오는 방식이 살짝 바뀌고 가격은 올라간듯. 여전히 건겅한 음식 가격이 아깝지 않은 풍성한 재료 담백한 맛까지~ 이번에도 대만족! 식전주 양이 많아졌고 올리브오일 따로주고 무엇보다 아보카도 풍성한 메뉴에 감탄~ / ☆☆내돈내산☆☆  웨이팅하기 편하게 가게앞 6인용 벤치있고 연락처남기면 순서대로 전화주심  순서되어 입장하면서 테이블 먼저 잡고  가게 입구에서 키오스크로 메뉴 선택하면됨  태어나서 처음 접해본 메뉴 걱정되었는데 정.말 건강하게 맛있는 맛 적당히 매콤하고 느끼하지않음.  낯선메뉴라 어떻게 먹어야할지 모르겠어서 당황했는데 직원분이 테이블마다 서빙해주시면서 설명 친절하게 해주심 빵도 3조각정도라 배고프지않을까ㅡ했지만 샐러드랑 빵. 스프까지 먹으니 너무배불러서 스프같은거 1/3정도 남김  논알콜 뱅쇼 + 올리브오일 조합은 너무너무 새롭고 맛있었음.  인테리어는 따뜻한조명 + 약간 어두운 분위기라 마음이 편안해지고 지인들과 도란도란 얘기하는 테이블이 많았음.  내돈내산이고 서울간다면 또 가보고싶음 / 위샐러듀일 때 오고 엄청 오랜만에 오는데 뭔가 메뉴가 더 다양해진 느낌? 다양하게 시켜서 나눠먹었는데 완전 짱이었어요. 식전 음료로 나온 논알콜 뱅쇼랑 엑스트라버진올리브유 섞은 것도 상큼했어요~ / 너무 이색적이고 맛있네요! 계속 생각나는 맛이예요~ 이전에 있던 메뉴도 있었으면 좋겠어요^^ / 맛집이란 말만 듣고 찾아간 집.   아이들은 지중해 음식을 처음 먹어봐서 기대하지 않았는데, 아이들도.. 부모님도 다들 넘넘 맛있게 먹었어요. 모습만 지중해가 아닌 맛도 지중해~   모든 메뉴가 하나같이 다 맛나고,  또 무알콜 뱅쇼를 주는데 것도 아이들은 신기해하며 같이 잘 마셨어요.   강추 음식점!  기대치 않고 왔다가 맛집리스트에 올린 찐맛집! / 지중해식 요리들을 접하기 힘든데 굉장히 잘 구현해주신 것 같아요. 한 번쯤 가보면 좋을 것 같은 식당입니다. 추천해요!  인테리어도 예쁘고 음식도 건강식 또는 비건인데 생각보다 양도 푸짐하고 맛있어요. 신기한 메뉴들이 많아서 다음번에는 다른 것들도 먹어보려고 합니다! 🌱😊 / 지중해 음식  먹는 방법도 설명해주고 무엇보다 낯설지만 맛있음  뱅쇼와 올리브유의 조합도 맛있고 샐러드이 올리브유 넣어 먹어도 맛있음",음식이 맛있어요,재료가 신선해요,특별한 메뉴가 있어요
10593 베이글커피하우스 신촌점,,"카페,디저트",,"매장이 넓으면서 소품들이 아기자기하게 잘 꾸며져있고 사진도 잘 나오고 예뻐요~ 단밤라떼 달다고 하는 분들도 있는데 전 단것도, 밤을 너무 좋아해서 맛있더라구요🌰🤎 커피도 적당히 밸런스도 좋아요 치즈믹스베이글은 빵도 쫀득하고 괜찮았는데 생각보다 치즈 맛이 많이 안나서 아쉬웠어요 / 신촌에 이런 곳이?! 2층으로 되어 있어 넓고 자리도 많아, 대화하러 오거나 작업하기도 좋은 공간이다 인테리어도 컨셉에 맞게 예쁘게 되어있고, 음식음료 다 맛있다. 특히 애플망고빙수는 아래 씨리얼까지 있어서 더 풍미가 느껴진다 화장실도 깨끗 / 베이글이 너무 먹고싶어서 찾아보다 방문했는데 이게 머선일이죠 너무 맛있어요 고구마 치즈 베이글 강츄 ❤️완전 제스타일 콘베이컨 샌디치도 담백하구 괜춘 하지만 원픽은 고치베 그리고 토마토 스프도 꼭 드세욘 매콤해서 느끼함 싹 잡아줌 쵝오 .. 서울오면 또 올게요오오 잘먹구 갑니당 🐣 / 이름은 베이글하우스지만 제발 수프를 드셔주세요ㅠㅠㅠㅠㅠㅠ 토마토 수프 그냥 토마토 그 자체인데 매콤해서 너무 감칠맛나고 맛있어요 그리고 크림치즈 진짜 안달고 너무 꾸덕하고 미쳤습니다 진짜 그동안 달아빠진 크림치즈를 먹은 제가 너무 불쌍해요 매장도 넓고 자리도 편하고 쾌적해요 근데 진짜 토마토 수프를 드셔주세요 ****토마토 수프**** 괜히 평일쿠폰으로 수프를 주시는게 아니에요 ********토마토수프******** / 2번째 방문이에요!! 전에 먹구 너무 맛있어서 또왔어요>< 아직 다 도전해보진 않았지만 블루베리랑 황치즈가 정말 맛있는거같아요  스프도 생각치못했는데 조합도 좋구 꽤 맛있었어요 담엔 토마토스프 도전하러 또올게요! / 바질 베이글 + 바질 크림치즈 추천하고,, 통밀 베이글 with 토마토숲 진짜 꼭 드세요 ... 너무너무너무너무너무너무 맛있습니다ㅜㅜ 너무 달고 짠 빵에 점령당한 코리아.. 너무 맛있어요 ! 그치만 난 자극이 필요하다! 하시는 분들 토마토숲 약간 스파이시하다는 것🌶️😘❤️ so much i love it everything 🌷 / 평일 오전에 방문했어요!  토마토 수프 진짜 맛있어요 ㅎㅎㅎ매콤하고 새콤해서 느끼할 수 있는 부분들을 싹 잡아줘요! 굿굿  베이글 맛있어요~~ 공간이 넓어서 여유롭고 2층 초록뷰가 이쁘네요 ㅎㅎ / 치즈러버로서 고구마 치즈 베이글과 황치즈베이글, 그리고 느끼함을 잡아줄 토마토 스프까지 주문해서 먹었습니다!! 요즘 유행인 쫜득한 베이글보다는 기본에 충실한 베이글이어서 추억이 돋았고 다 각자의 맛이 잘 느껴져서 생각한 맛 그대로였습니다! 여러분 근데 스프가 찐이에요… 토마토랑 양송이 스프 2종류가 있는데 제가 먹은 토마토 스프는 매콤한게 물리는걸 잡아주더라구요! 다음에는 양송이 스프랑 베이글 샌드위치 도전해볼 예정입니다! / 신촌 명물거리에 생긴 베이글 카페로 저번달인가 생긴것 같더라구요. 수원에서 유명한 곳 같았습니다. 베이글 종류도 다양하게 있고 1층과 2층까지 자리들이 있어서 넓은 편이었습니다. 베이글이 있는 쪽에 인테리어도 예뻤고, 시그니쳐인 단밤도 맛있게 먹었습니다. 외국인들도 많이 오시는것 같았어요. / 빵순이 셋이 나들이 나와서 왔어요ㅎㅎ신촌역에 냅다 내려서 찾아온 곳인데 정말 잘 먹었습니다💕 기대 이상으로 재료가 신선하고 풍성해요 음료도 자두에이드와 딸기라떼 모두 맛이 진해서 좋았어요 인테리어도 예쁘고 깔끔해요! 또 오고 싶은 맛집을 찾았습니다😋❤",디저트가 맛있어요,인테리어가 멋져요,커피가 맛있어요
한술식당 신촌점,,한식,,"맛있어 보이는 게 많아 고심하다가 우삼겹덮밥과 고추장삼겹살덮밥 시켰습니다. 일단 너어어어무 맛있고요 음식 나오자마자 풍기는 고기향과 밥향에 정신이 혼미하네요..♥️🍚 수란 터트려서 먹으면 고소하니 짱이구요, 양배추 절임 적절하니 아삭아삭 맛나요,,🥹 신촌 맛집 하나 저장하고 갑니다. 든든한 한 끼 감사합니다:) / 곱창덮밥이랑 고추장삼겹살덮밥 먹었어요! 가성비가 진짜 좋은 거 같아요! 가격이 착한데 양이 많고 고기가 지이이ㅣ인짜 많아요 사이드로 고로케 먹었는데 자색고구마 고로케가 진짜 맛도리에오.. 처음 먹어보는 맛인데 진짜 맛있어요!!!! / 곱창 치즈 덮밥에 치즈 하나 더 추가했는데 짱 꾸덕하고 맛나용ㅜㅠ 친구가 시킨 마라 곱창덮밥도 마라향이 강해서 좋더라구용☺️❤️ 그리고 다른 친구는 간장삼겹덮밥 시켰는데 넘 맛있다구 울 셋중에 젤 빨리 먹었어요🤣🤣  양은 생각보다 많아서 먹어도 줄지 않네요👍👍 / 제가 먹은 덮밥집 중에 제일 양많고 맛있었어요!! 치즈닭갈비 덮밥은 맵긴한데 맛있게 매워요 ㅎㅎ 곱창 덮밥에는 넓적당면까지 들어가 있어서 더 쫄깃쫄깃하고 맛있었어용!! 매울때쯤 먹어줬던 치킨가라아게도 입에서 살살 녹아요..👍 완전 가격도 저렴해서 가성비맛집이에요!! / 매콤한 소스에 씹는 맛이 있는 당면과 마늘 후레이크 그리고 잘 지은 쌀밥이 예술 정갈한 한상 차림이라 저렴한 가격대인데도 대접 받는 느낌 양이 정말 많아서 어지간히 양 많는 사람들에게도 벅찰 것 같음 / 친구와 점심먹으러 방문했어요! 한식이 먹고싶어서 갔는데 다양한 덮밥 메뉴가 있어서 좋았어요^^ 곱창덮밥과 치즈닭갈비 덮밥 주문했어요~ 곱창이 쫄깃하고 맛나네요! 당면과 야채도 많이들어있어서 좋고 많이 맵지않아서 맵찔이인 저도 맛있게 잘먹었어요^^ 치즈닭갈비 덮밥도 고기가 부드럽고 양념이 적당하게 매콤하고 맛있었어요 ㅋ 모두 국내산 야채와 신동진쌀을 이용해 맛도 건강도 다 챙길수 좋으네요 👍🏻 👍🏻 덮밥 안에 들어있는 갈릭후레이크가 바삭하고 마늘향이 나서 독특하고 맛나요^^ 사이드메뉴인 반반고로케도 감자와 고구마 고로케 반반씩 맛볼수 있어서 좋았고 매콤한 덮밥에 곁들여 먹기딱이네요^^ 신촌맛집으로 추천합니다! / 친구랑 신촌 온 김에 호다닥 검색해서 왔는데 역에서 너무 멀지도 않고 맛있었어여! 가격도 양이랑 맛에 비해서 완전 가성비이고 직원분들도 친절하고 센스 넘치세요! 제가 흰 옷 입었는데 말 안해도 앞치마도 가져다 주셨어요 ㅎㅎㅎ 다음에 신촌 오면 또 갈거 같아요!😍 / 신촌에서 든든한 점심식사 할 수 있는 곳을 찾다가 방문했습니다! 우삼겹 덮밥은 고기도 질기지 않고 간장 소스도 짜지 않아서 너무 맛있게 먹었어요👍 마라곱창 덮밥은 마라의 얼얼한 맛이 강해서 매운것 좋아하시는 분들에게 추천하고 싶습니당 / 사장님 직원분 엄청 친절하십니다. 엄마랑 방문해서 간장삼겹덮밥이랑 원조곱창덮밥 주문했어요~간장삼겹덮밥 맛있어요!!밥 부족하면 서비스로 더 주신다고합니다~양이 어마어마해서 저는 남겼어요~ 가성비짱~맛집 인정!! / 신촌 대학생들의 속을 든든하게 채워주는 맛집, 한술식당 신촌점 다녀왔습니다. 덮밥 전문점이라 바로 베스트 메뉴 두개시켰는데 엄청 푸짐한거있죠?? 왜 재방문율이 높은 맛집인지 한번에 알 수 있었습니다. 이 가격에 사장님 괜찮으신지 모르겠지만 학생들을 위해 영업해주시는 마음 감동적이었습니다!",음식이 맛있어요,양이 많아요,혼밥하기 좋아요
미도인 신촌,4.49,양식,농림축산식품부 제공 안심식당,"아이키우는 애엄마라 이렇게 정갈한 한상을 언제 먹었는지 매번 아이들이 좋아하는 돈까스, 생선구이, 칼국수 이런것만 먹다가 내가 좋아하는 곱창에 스테이크 한상  혼자가서 먹으니 너무 좋았어요. 특히 단호박 스프 엄청 부드러워요!! 진짜 어느하나 맛이 없는게 없어요. 너무 맛있었어요!! 내가 원하는게 바로 이런거 였음!!  혼밥하고 너무 행복한 하루였습니다😊 잘먹었습니다! / 봄에 데이트를 한다면 강력 추천하는 곳인데요🌸 2층에 위치해 있어서 벚꽃뷰를 바라보면서 맛있는 덮밥을 먹을 수 있다는 것은 너무 행복하잖아요😇  스테이크 덮밥, 대창 덮밥 아는 맛인데도 계속해서 먹게 되는 마법을 가진 곳이예요!🍚 특히 한상차림에서 사이드로 나오는 샐러드랑 계란이 그 맛을 더 돋궈주기도 합니다🥗 그리고 스카치 에그🧆 꼭! 드셔보세요! 튀긴 것도 맛있는데 고기와 반숙을 튀긴다면.. 맛이 없을 수가 없는 조합이니까요!! / 음식이 맛있어요! 스테이크 부드러워요! 맛있게 먹었어요! / 스테이크와 대창이 생각보다 많이 들어있어서 너무 맛있게 잘 먹었습니다! 넘 맛있었어요!! / 오래간만에 점심먹으러 찾았네요  오면 항상 만족스러운 곳.. 맛있고 다양한 메뉴도 좋고.. 주변에 갈 곳이 많아서 자주는 못오지만  항상 다시 오고 싶은 곳입니다 ㅎ / 웬만하면 안 좋은 리뷰는 안 달려고 하는데 이해가 가지 않아 리뷰 남깁니다 ^^;; 약 30분을 기다려도 제 메뉴는 나오지 않았지만 제 뒤로 온 3팀 7명의 메뉴는 제꺼보다 먼저 나왔구요 제가 왜 안나오냐고 물어보니, 면 삶는 시간이 오래걸린다는 답변만 들었습니다. 7명 음식이 다 나오는 시간보다 소바 하나 나오는 시간이 더 늦다는게 이해가 가지 않구요. 중간에 지나가시면서 제 테이블 번호 말하시면서 아직 메뉴 안나왔다고 말씀 하셨는데, 제 주문이 누락됐던거는 아닌가요? 면을 거의 30분동안 삶지는 않을것같아서요 ^^.. 누락이 아니었다면 면 나오는 속도가 개선될 필요가 있다고 느낍니다. / 신촌벚꽂로에서 벚꽃을 바라보며 맛있게 식사했어요 창가자리 분위기 너무 좋아요 / 보통 미도인에서는 스테이크 메뉴들을 자주 먹었는데 마제소바 가성비도 괜찮고 맛있었어요! / 가성비 좋고 맛도 괜찮아요. 친절하시고 좋아요~ / 후기가좋아서 갔는데 너무짜고 자극적이었어요 곱창도 질기고 별로였음",음식이 맛있어요,특별한 메뉴가 있어요,인테리어가 멋져요
히츠지야 신촌점,,요리주점,,"일단 인테리어가 일본 분위기 나서 일본 여행온 느낌나서 너무 좋았구요! 훗카이도 세트 시켜서 먹었는데 가성비로 양질의 양갈비 먹을 수 있어서 좋아요! 양갈비 진짜 맛있구 사이드 메뉴들도 다 맛있습니다! 특히 타코 가라아게는 완전 제 스타일이에요! 직원분들도 친절하셔서 다음에는 무한리필 먹으러 다시 방문해야겠어용! / 우선 직원분들이 친절하셔서 좋았고 매장 내부가 일본처럼 꾸며져 있어서 일본 놀러온 느낌이에요 게다가 일본인 직원분이 계셔서 더 일본스러운 느낌! 노래까지 일본노래들 나와서 더 좋았습니다. 고기도 괜찮았고 메론소다 맛있어요! / 신선한 양갈비 양고기를 먹으면서 일본 놀러간 분위기를 느낄 수 있는 곳이에요. 추억의 제이팝 들으며 라떼 소환하기 좋아요. 양고기도 있지만, 사이드에 다양한 마제소바나 카레, 오차즈케 같은 의외의 메뉴가 있어서 골라먹는 재미가 있네요. 배만 안찼으면 몇개 더 먹어보는건데… 위장이 블랙홀이면 무한리필 추천합니다! 타베호다이, 노미호다이까지, 일본 분위기 뿜붐이네요! / 신촌 양갈비 맛집 히츠지야 신촌점💙 히츠지야 체인점 자체는 워낙 유명한 양갈비 맛집이기에 다른 지점으로 자주 방문했었는데 이번에는 우연한 기회로 신촌점을 방문하게 되었네요! 신촌점은 마치 일본 오사카 도톤보리 거리에 여행온 듯한 기분이 들도록 인테리어가 되어있어 먹는 재미와 보는 재미가 함께 있어 즐거운 매장이었습니다! 술도 정말 다양하게 준비되어 있어 즐겁게 술 한잔 즐기고 싶을때 히츠지야 신촌점 추천드려용💙💙 / 양갈비 맛집입니다!!! 6개월 미만의 신선한 양고기를 사용한다고 하는데 진짜 잡내도 안나고 부드럽고 맛있었어요 ㅎㅎ 럼프살은 좀 더 담백하고 기름기가 적은 느낌! 스키야키나베도 국물이 진하고 맛있고 ㅋㅋ 특히 저는 피치하이볼이랑 크림메론소다도 같이 시키길 너무 잘했다 싶었어요 ㅎㅎ 술 잘 못마시는데 달달해서 좋았어요!! 가격도 너무 괜찮고~ 일본으로 여행온 느낌까지!! 히츠지야 신촌좀 다음에 또 방문할게요!^^ / 양고기가 이렇게 맛있는 지 처음 알았습니다 .. 양꼬치도 마다하던 저인데 .. ㅠㅠ 여기 너무 맛있네요 !! 신촌오면 자주 들릴게요 >< 분위기도 완전 일본풍이라 제 취향이었어용 ㅎㅎ / 간단한 주먹밥류가 땡겼는데 메뉴 중 오니기리가 보여서 들어갔던   분위기 니뽄풍 지렸다.  술이 아니라 밥먹으러 온새램덜   징기스칸찹은 고기 촉촉하고 맛있는데  양이..쩝 맛있으면 된건가효ㅎ.ㅎ  체리 에이드랑도 잘 어울림(체리콕맛)  야키오니기리는 안에 참치들어잇고  간장베이스 주먹밥 같았다!   젓가락 벚꽃 디테일 무엇,, 인기 많은 데는 이유가 있다👍🏻 / 양갈비를 좋아하는 이들에게는 이 곳은 천국이쥬 !  양갈비만 있는 게 아니라 술종류도 다양하고 맛있는 안주도 다양해서 눈도 즐겁고 입도 즐거웠던 곳 !  합리적인 가격과 맛있는 양갈비를 즐길 수 있어서 너무 만족해요! 아니 만족이 아니라 완전 대만족 !!!!!!  하나부터 끝까지 너무나도 완벽했던  신촌역 맛집 히츠지야 꼭 가보는 걸 추천드려요. / 신촌 양고기 양갈비 맛집으로 인정하는 히츠지야 신촌점이예요  해피아워타임에는 생맥주를 저렴하게 마실수 있는데다 양고기에 잡내도 없고 퀄리티도 좋아서 맛있고 배부르게 먹을수 있었어요 다구워주시니까 편하게 데이트하기에도 딱이고 신촌 단체모임도 완전가능 !!   💜*이 글은 리뷰진 체험단으로 선정되어 업체로부터 제품을 제공 받아 솔직하게 작성한 후기 입니다*💜 / 완전 일본 여행 온듯한 기분을 낼 수 있는 곳이예요! 분위기만 좋은 게 아니고 잡내 없이 양고기 질도 너무 좋구요, 2인 홋카이도 세트 메뉴 구성도 알차고 굿입니다! 메론소다까지 먹어주니 일본 여행 기분내기에 최고였어요! 직원 분들도 너무 친절하셔서 좋았고요, 고기도 첨엔 설명해 주시며 구워주시니 편했습니다😇✨ 신촌 양갈비 맛집으로 대박 추천합니다!🥰",음식이 맛있어요,인테리어가 멋져요,고기 질이 좋아요
부엉이산장 신촌점,,요리주점,,"비오는 토요일 맛있게 먹기 좋은 곳입니다. 배가 너무 고파 곱도리탕 먹다가 찍은 사진이지만 맛있어서 또오고 싶어요. 감태는 감태향이 아쉽지만 맛있을 수 밖에 없는 조합! 다양한 술과 맛있는 음식을 함께할 수 있는 곳입니다! / 곱도리탕을 처음 먹어봤는데 정말 맛있었어요. 매콤한 양념이 곱창과 닭고기에 잘 배어 깊은 맛이 났습니다. 푸짐한 양에 비해 가격도 합리적이라 만족스러웠어요. 친절한 서비스 덕분에 기분 좋게 식사할 수 있었습니다. 다음에도 꼭 다시 찾고 싶은 맛집입니다. / 남자친구랑 비도오고해서 전이 땡겨서 왔어용! 막걸리도 종류별로 다있고 일단 치즈감자채전이랑 막걸리 시켰는데 맛있어요!! ㅎㅎㅎㅎ / 평소에 곱도리탕을 자주 먹는데 술과 함께 먹는 메뉴로 늘 적당하고 맛있습니다~!! 여기도 맛있어서 또 올 것 같아요오!!☺️ 사이드메뉴도 여러가지여서 좋았습니다! / 친구들이랑 6명정도 다같이왔는데 자리도 넓고 너무 좋네요!!!! 인테리어도 너무 이쁘고 맛있어요 ㅎㅎ 😆😆🥹 / 보기드문 안주맛집😋 뭘시켜도 맛있네요👍 전이 진짜 바삭해서 제 최애❣️ / 🔹 주문 메뉴: 곱도리탕, 치즈 감자채전  인테리어와 컨셉이 독특하고 조명이 어두워서 2차로 방문 하기 좋은 곳이었어요! 음식은 양도 생각보다 많고 종류가 다양해서 단체로 방문하기 좋은 곳 같습니다 곱도리탕에 재료는 많이 들어가 있으나 곱이 많은 편은 아니었어요 감자채전은 조금 느끼했지만 치즈도 많이 들어가 있고 얇고 바삭해서 맛있었어요! / 새우도 통통하고 너무 맛있어요 친구들이랑 수다떨기 너무 좋아요 비오는 날 막걸리에 전 먹을 수 있어서 행복했어요🥰🥰 / 가족끼리 2차하러 왔는데 안주가 너무 맛있어서 계속 들어가요!!! 골뱅이 실한것봐🥹🥹🥹 / 한식술집 찾다가 발견한 부엉이산장 신촌점! 대표메뉴인 곱도리탕 너무 맛있게 먹고 왔어요!! ☺️☺️ 한식파인데 맛있는 한식안주들이 많아서 자주 방문할 것 같아요! 매장컨셉도 너무 예쁘고 아늑하고 좋아여 ✨✨ 또 방문할게요 ! 🖤",음식이 맛있어요,인테리어가 멋져요,술이 다양해요
