name,rating,type,descript,reviews,keyword1,keyword2,keyword3
강남불백 신촌점,4.45,"백반,가정식",가성비 좋은 이화여대 밥집,"처음엔 밥통 안의 밥 양이 너무 적다고 생각을 했는데, 적진 않지만 많지도 않음..😏  불고기 양이 생각보다 많아서 놀랐음 같이 나오는 된장찌개가 음식들보다 한~~참 뒤에 나와서 거의 밥을 반절 이상 먹고 나서 같이 먹었는데.. 아쉬웠음…ㅜㅜ목이 많이 맥히는 맛이라 찌개가 더 빨리 나왔으면 좋았을텐데 하면서 먹음  점심시간엔 사람들이 정말 꾸준히 밀려드는 곳 간단하게 한 끼 든든히 채우기 좋았다 / ᴍ ᴇ ɴ ᴜ 불백정식(10000₩) /  기본안주로 계란후라이랑 된찌가 같이 나옵니다! 불백정식 고기도 맛있어요! 밥이랑 너무 잘 어울리는 양념입니다  하지만 밥 양이 정말 적어요,,,ㅠㅠ / 불백정식에 나오는 돼지불고기 양이 많고 매콤하니 맛있습니다. 계란후라이, 된장찌개, 마카로니샐러드, 무생채,볶은 김치도 함께 나와 반찬도 실합니다. 혼밥을 하더라도 잘 먹고 싶을 때 오면 될 것 같습니다! / 두번째 방문인데요, 처음 방문 때 진짜 맛나게 잘먹었는데 이번에는 잡내가 너무 나네요. 글구 서빙이모님 홀에서 왤케 소리를 지르시는지? 떽떽거리는 소리에 귀가 아파서 밥먹다 체하는 줄 알았어요. 너무 시끄럽고 요즘 테이블마다 주문기들 다들 놓는데 그런거라도 좀 놓으세요. / 무난한 한끼. 금액대가 저렴한거 치고는  고기보다 양파 비율이 많아요 고기의 조금의 잡내는 있었구,  치즈보단 그냥 기본이 나은거 같아요 전 항상 가던 원조가 낮네요..🫠 비슷한 느낌이라 차린건 비슷하지만  조금 아쉬웠어요 / 매장도 쾌적하고 불백도 좋고 친절하고 좋았어요! 다음에 또오고싶은 곳이에요! / 저희 점심 먹으러 불백정식에 계란말이 주문했어요.😊 불백정식~ 불향이 강하고 간간해서 맛있어서 밥 한공기 뚝딱.! 달걀말이도 통통하고 양이 많았어요. 점심 배불리 먹고 가요.👍👍 / 가게 직원들이 전부 중국인이네요.. 주문한다고 했더니 카운터에 서서 말하라고 하심. 목소리 작으면 승질내면서 옴. 반찬이랑 밥도 테이블로 던져줘서 깜놀했네요. 대륙의 서비스는 이런건가....? 염색한 젊은 남자였는데 불쾌했어요. 가게 직원 모두 중국인이고 원산지 글씨도 삐뚤빼뚤. 김치도 중국산.. / 오늘도 역시 맛있게 잘 먹었습니다. 올 때마다 만족도 최상입니다!!! / 직원 분들도 친절하시고 불백정식도 양많고! 대박 맛있었어요!!",음식이 맛있어요,가성비가 좋아요,혼밥하기 좋아요
삼산회관 신촌점,,"육류,고기요리",,"벌써 4번째 방문이네요!! 신촌에서 김치찌개 제일 맛있다고 단정할 수 있어요ㅠㅠ엄마 김치찌개 그맛이에요ㅠㅠ계란말이도 맛있었구 이번에는 감자볼 시켜봤는데 갓 튀기셨는지 완전 바삭하고 뜨거워서 신나요...저처럼 밥을 반 남겨 국물에 먹고 반은 셀프바에 있는 재료들을 섞어 마무리를 볶음밥처럼 즐겨보세요 극락입니다...꼭 오셔서 진짜 맛보세요ㅠ저는 개인적으로 김치찌개 너무 취저라 여기만 올거에요ㅠㅠ / 두루치기 진짜 좋아하는데 너무맛있어요 ㅠㅠ 예전부터 꼭 가보고싶었던 음식점이였는데 역시나 기대를 져버리지않는 맛이엿구요 ㅠㅠ 셀프바도 알차게 있어서 김가루 옥수수콘 무한리필이라 너무좋앗음요 ㅠㅠㅠㅠ 마지막 볶음밥 킬링포인트!! 맥주를 부르는 술안주제격이네요 결국 낮술했네요 ㅎㅎㅎㅎ 다음에 또 갈래요 진짜 양념부터 김치까지 굳굳 이수지언니픽은 항상 옳다 ㅎㅎ / 돌싱포맨 보면서 넘 맛있어보여서 친구랑 밥먹으러 갔어요!! 인테리어도 레트로 갬성 뿜뿜💕 분위기 너무 좋아요!! 돼지김치구이는 제육볶음과는 아예 다른 매력! 아삭한 김치와 두툼한 숙성돼지고기의 조합이 너무 잘 어울리고 맛있네요^^ 계란말이와 주먹밥이랑 곁들여 먹으니 더 맛있어요 ㅋ 셀프바에서 반찬도 마음대로 가져다 먹을 수 있고 맛있게 먹는 다양한 조합들이 붙어있어서 따라서 먹어보니 너무 맛있고 재밌어요! 식당 옆에 바로 주차장도 있어서 너무 편하고 화장실도 식당내부에 남/녀 구분되 있으니 아주 좋아요🥰 음식맛도 편의시설도 모두 만족 입니다^^ 신촌김치삼겹살 완전 추천해요! / 🫢😎🫶사장님 너무너무 친절 앤 쏘 스윗 음식도 너무 맛있구요  여러 질문에도 잘 받아주셔서 감사합니다🌟 너무너무 잘먹고 편안하게 있다가용~~~!!!  닭김치구이랑 돼지김치찌개 맛도리~~👍👍 꼭 드시러오세용 :-) / 점심 때 왔는데 주차도 가능하고 점심 셋트 구성이 잘 되어있어요👍 세트 메뉴 강추합니다‼️ 두번째 방문인데 역시 맛있네요~~~ 볶음밥까지 저녁 회식때 와두 좋을 것 같아요🫶 / 삼산회관 너무 좋아하는 프랜차이즈여서 오늘은 신촌에서 방문했는데 사람이 많은 이유를 알정도로 직원분들께서 너무 친절하시고 회전속도도 빠르고 셀프바가 신선하게 구비되어 있었어요 ㅎㅎ신촌에는 다양한 프랜들과 가성비 좋은 포차들이 즐비해서 항상 고민하기 일수였는데 이제는 삼산회관 신촌점으로 고정 ㅋㅋㅋㅋ이예요 / 기존의 제육볶음, 두루치기와 달리 여기는 고기를 먼저 구워서 육즙도 있고 고기가 두껍고 김치랑 두부도 너무 맛있어요! 가성비도 최고입니다!! 양도 많고 계란말이랑 주먹밥도 정말 맛있었어요  신촌 음식점 중 유일하게 주차장도 있고 실내에 화장실도 남,여 구분으로 있어요! 또 방문할 예정입니다 💕 / 돼지김치구이 세트 가성비도 좋고 셀프바도 있어서 정말 푸짐하게 먹을수있어요 주먹밥도 맛있고 김치구이 깻잎에 마요네즈랑 싸먹으면 특히 맛있어요 👍👍👍 일단 브레이크타임도 없어서 넘 좋습니다 / 아니 .. 사장님 남는게 있으세효 ..?? 신촌 대학로라 그런지 진짜 핵가성비❤️❤️ 연대생들 너무 부러움ㅠㅠ 돼지김치구이에 우동사리 필수🥰 거기다 원래 볶음밥 다른 곳 3,000원인데 여기는 공깃밥 1,000원 시켜서 알아서 김에다 옥수수콘 셀프바 이용해서 볶아먹음 돼요!~!!! 사장님이 맛있고 음식이 친절해요👏🏻👏🏻 다음엔 김치찌개 먹으러 갈게요! / 고기 양도 많고 냄새도 하나 안나고 두부, 파, 양파 등 다양하게 들어가있어요ㅎㅎ 옥수수콘이랑 마요네즈랑 쌈싸먹는게 젤로 맛있네요 ! 국물도 자작하게 있어서 좋고 자극적이지 않아요 :) 잘 먹었습니당 ㅎㅁㅎ 다음에 또 올게요!",음식이 맛있어요,양이 많아요,고기 질이 좋아요
리정원 신촌점,,"육류,고기요리",,"밑반찬이 엄청 알차게 나와서 놀랐어용🥹 직원분들도 친절하시구 매장도 시원하니 쾌적해서 기분 좋게 저녁을 해결할 수 있었습니다~~ 신촌에서 이렇게 가성비 좋은 고깃집에서 저녁을 해결할 수 있어서 좋았습니다❤️❤️ 번창하세요~!!! / 평일 이른 저녁부터 사람이 많길래 얼마나 맛있나 했는데, 고기뿐만 아니라 밑반찬까지 전부 맛있네요! 사이드메뉴 종류도 많아서 뭐 주문할지 고민하다가 순두부랑 볶음밥 시켰어요!! 다 맛있으니 꼭 주문해드세요 / 우연히 길가다 고기가 먹고싶어 들린 집인데 고기랑 밑반찬 퀄리티가 장난 없네요  사장님이 고기에 진심이신 거 같아요 사이드로 시킨 순두부찌개도 아주 맛있어요 기본적으로 음식을 잘하는 집인 거 같아요 재방문 의사 있습니다! / 꽃삼겹이 제일 잘나간대요! 5분정도 웨이팅했고 불이 약해서 숯도 더 알아서 넣어주시고 그리고 무엇보다 고기가 잘려서 나와서 뒤집기만 하면 되서 너무 좋았어요!! 고기도 짱맛! 잘먹겠습니다❤️ / 팀회식을 하려고 갑작스럽게 찾아서 방문하게 되었는데 너무 시원한 환경에 이미 기분이 좋았습니다 고기도 삼겹살이랑 항정살 다 시켰는데 너무 맛있더라구요 다음에도 계속 찾아와서 먹을거같습니다 자리도 괜찮게 구성되어있어서 편했습니다 맛있게 잘 먹고 갑니다~ / 처음에 나오는 반찬들도 진짜 맛있어요 김치찜이 너무 맛있었어요 💖 고기도 부드럽고 밥이랑 같이 먹으니까 너무 맛잇었어요!! 남자친구랑 같이 와서 먹었는데 남자친구 너무너무 좋아하는 고깃집이었어요 👍🏻👍🏻 진짜 맛집입니다 와서 꼭 드셔보세요!! / 점심메뉴 김치두루치기 맛있어요👍 솥밥 좋아요~~반찬도 깔끔해서 좋아요 / 식당 내부도 깔끔하고 상차림도 너무 깔끔해요. 고기 질도 좋고 고급스러워서 좋네요. 직원분들도 친절하고 맛있어서 다음에 또 와야겠어요. / 처음 가봤는데 우선 엄청나게 푸짐한 밑반찬에 놀랐고 고기 맛에 놀랐어요~! 오랜만에 건강하고 맛있게 잘먹었습니다 직원 분들도 정말 친절하세요 감사합니다~! / 드디어 기다리고 기다렸던 리정원 왔는 데 기본상에 깜놀했어요! 김치찜에 양념게장 그리고 여러가지 장들까지 맛도리🥰 3000번의 칼집이 나서 그런지 입안에서 녹아요 녹아 ㅠㅠㅠㅠ 왜이리 인기가 많은지 실감했어요!! 앞으로 자주 올 듯해요!!",음식이 맛있어요,고기 질이 좋아요,친절해요
머노까머나 신촌점,4.58,인도음식,신촌 인도 커리 맛있는 곳,"인도커리랑 난이랑 조합 최고에요,,, ㅠㅠ 적당히 매콤한 맛이어서 더 좋았어요 ㅠ 치킨티카마살라 완전 추천이요,,!!!! 난은 버터난 갈릭난중에 저는 갈릭난이 더 제스타일이엇는데 남자친구는 버터난이 더 좋앗대요!!! 밥이랑도 먹고 난도 찍어먹고 교정기 떼고 커리먹으니까 너무 행복,,,,!!!! / 인도커리 좋아한다면 가볼만 한 곳이에요 ! 직원 분들도 현지분들이라 여행 온 느낌이었고 버터치킨 커리도 고소하고 부드러워서 맛있게 먹었어요👍🏻 치킨티카는 순살이라 먹기 편해서 추천합니당 ! / 늘 맛있는 머노까머나입니다. 저는 송도 지점만 가봤었는데 오랜만에 인도음식 세트a로 빵빵하게 먹고왔어요 이미 종류가 세팅되어있어 고르지 않아도 좋고 구성대로 먹으면 배부르고 맛있게 먹을수 있어요 / 가성비 좋게 인도커리를 먹을 수 있는곳! 일하시는 분들이 현지분들인데도 한국말을 너무 잘하셔서 좋았어요 ㅎㅎ 브레이크 타임두 없고 신촌에서 인도커리맛집으로 찜콩입니다! / 9명이서 커리 5개, 난7-8개? 라씨, 망고주스 등 시켜먹었습니다.  버터 치킨커리, 머턴 더 피아자(매콤한 양고기), 빨락 빠니르(시금치), 프라운 마카니(안매운 새우)에 추가로 하나 더 시켰는데, 진짜 다 맛있어요♥︎ 그 중에서도 양고기가 정말 맛있었습니다.  난은 갈릭난, 스위트난, 치즈난 시켜봤는데, 갈릭난이랑 스위트난이 맛있습니다!! 치즈난은 다들 조금 심심하다고 하더라고요.  망고라씨 정말 맛있고, 망고주스는 그냥 마트에서 파는 망고주스 맛이라고 해서 라씨로 추천드려요!  생각보다 많이 저렴한데 맛도 좋아서 인도커리 좋아하시면 완전 추천합니다👍🏻 / 2인세트로 먹었는데 탄두리랑 커리 밥 난 샐러드에 요거트까지 다양하게 많이 나와서 좋았습니다 사장님도 친절하시고 손님도 끊이질 않는 맛집이었네요! / 인도분이라 말투가 조곰 차가워서 당황해찌만ㅋㅋ  커리랑 라씨 난 전부다 너무 맛있었음 샐러드 드레싱 너무 새콤달콤해서 좋아:) / 여기 진짜 찐이에요❗❗ 인도에 가본건아니지만 현지에서 먹는 느낌 가득하고, 사장님이 한국어도 잘하세요 ㅎㅎ 시금치카레가 진짜 맛있고, 탄두리치킨과 난도 진짜 맛있어요🥰🥰 / 인도인 사장님께서 운영하는 커리집이라 그런지 매장 인테리어부터 식기류까지 완전 인도 느낌이에요~ 개인적으로 저는 스프를 안 좋아해서 B세트 시켜 먹었는데 양도 2명이서 먹기 딱 좋았고, 그린 샐러드 + 시금치 커리 + 치킨티카 + 라씨 조합도 잘 어울렸습니다! / 난이 완전 완전 맛있음!! 바삭바삭 쫄깃한 난 최고예요 👍  라씨도 맛있었어요!! 양도 넉넉해서 남기고 왔습니다~~",음식이 맛있어요,인테리어가 멋져요,친절해요
아민 이화,4.62,양식,,"제법 더운날, 먼거리를 찾아간 보람이 가득한 날! 이곳을 콕! 찍은 저의 선택에 어깨가 으쓱해진 날! 처음 먹어보는 색다른 음식에 기대도 컸는데 그런 기대를 배이상 충족시켜준곳이에요~♡  뱅쇼에 올리브유를 2대 1로 섞어마시는 요거, 특이했구요~ 이쁘고 다양한 플레이팅에  제대로 대접받는 느낌이라 감동이었어용~^()^ 이 느낌 그대로 먹는내내 행복했습니다~ 모든 음식이 다 만족스러워서 가까운곳에 있다면 사랑하는 사람들 한번씩 다 데려가서 맛보여주고싶네용!!! 최고의 한끼!!!  직원분들도 너무 친절하셔서 이또한 재방문 하고픈 이유입니당~♡ / 처음 먹어보는 음식이라 맛있을지 어떨지 걱정되었는데 걱정이 무색할정도로 굉장히 맛있었어요! 뱅쇼랑 올리브유를 같이 섞은 식전주도 맛있고 새롭더라구요ㅎㅎ서빙해주시고 어떻게 먹는지 방법을 친절하게 설명해주셔서 그 점도 좋았습니다💓 / 결혼 후 15년만에 신촌 나들이 리뷰 보고 선택한 아민 이화 평상시 접하지 못한 음식이라  아이들의 호응을 받지는 못했지만 타국 음식 느끼고 싶을때 특별한 음식 먹고 싶을때 추천드려요 사장님께서 알려주시는대로 드셔 보세요 음식을 배로 즐길 수 있어요 / 작년에 방문후 재방문. 메뉴와 음식나오는 방식이 살짝 바뀌고 가격은 올라간듯. 여전히 건겅한 음식 가격이 아깝지 않은 풍성한 재료 담백한 맛까지~ 이번에도 대만족! 식전주 양이 많아졌고 올리브오일 따로주고 무엇보다 아보카도 풍성한 메뉴에 감탄~ / ☆☆내돈내산☆☆  웨이팅하기 편하게 가게앞 6인용 벤치있고 연락처남기면 순서대로 전화주심  순서되어 입장하면서 테이블 먼저 잡고  가게 입구에서 키오스크로 메뉴 선택하면됨  태어나서 처음 접해본 메뉴 걱정되었는데 정.말 건강하게 맛있는 맛 적당히 매콤하고 느끼하지않음.  낯선메뉴라 어떻게 먹어야할지 모르겠어서 당황했는데 직원분이 테이블마다 서빙해주시면서 설명 친절하게 해주심 빵도 3조각정도라 배고프지않을까ㅡ했지만 샐러드랑 빵. 스프까지 먹으니 너무배불러서 스프같은거 1/3정도 남김  논알콜 뱅쇼 + 올리브오일 조합은 너무너무 새롭고 맛있었음.  인테리어는 따뜻한조명 + 약간 어두운 분위기라 마음이 편안해지고 지인들과 도란도란 얘기하는 테이블이 많았음.  내돈내산이고 서울간다면 또 가보고싶음 / 위샐러듀일 때 오고 엄청 오랜만에 오는데 뭔가 메뉴가 더 다양해진 느낌? 다양하게 시켜서 나눠먹었는데 완전 짱이었어요. 식전 음료로 나온 논알콜 뱅쇼랑 엑스트라버진올리브유 섞은 것도 상큼했어요~ / 너무 이색적이고 맛있네요! 계속 생각나는 맛이예요~ 이전에 있던 메뉴도 있었으면 좋겠어요^^ / 맛집이란 말만 듣고 찾아간 집.   아이들은 지중해 음식을 처음 먹어봐서 기대하지 않았는데, 아이들도.. 부모님도 다들 넘넘 맛있게 먹었어요. 모습만 지중해가 아닌 맛도 지중해~   모든 메뉴가 하나같이 다 맛나고,  또 무알콜 뱅쇼를 주는데 것도 아이들은 신기해하며 같이 잘 마셨어요.   강추 음식점!  기대치 않고 왔다가 맛집리스트에 올린 찐맛집! / 지중해식 요리들을 접하기 힘든데 굉장히 잘 구현해주신 것 같아요. 한 번쯤 가보면 좋을 것 같은 식당입니다. 추천해요!  인테리어도 예쁘고 음식도 건강식 또는 비건인데 생각보다 양도 푸짐하고 맛있어요. 신기한 메뉴들이 많아서 다음번에는 다른 것들도 먹어보려고 합니다! 🌱😊 / 지중해 음식  먹는 방법도 설명해주고 무엇보다 낯설지만 맛있음  뱅쇼와 올리브유의 조합도 맛있고 샐러드이 올리브유 넣어 먹어도 맛있음",음식이 맛있어요,재료가 신선해요,특별한 메뉴가 있어요
10593 베이글커피하우스 신촌점,,"카페,디저트",,"매장이 넓으면서 소품들이 아기자기하게 잘 꾸며져있고 사진도 잘 나오고 예뻐요~ 단밤라떼 달다고 하는 분들도 있는데 전 단것도, 밤을 너무 좋아해서 맛있더라구요🌰🤎 커피도 적당히 밸런스도 좋아요 치즈믹스베이글은 빵도 쫀득하고 괜찮았는데 생각보다 치즈 맛이 많이 안나서 아쉬웠어요 / 신촌에 이런 곳이?! 2층으로 되어 있어 넓고 자리도 많아, 대화하러 오거나 작업하기도 좋은 공간이다 인테리어도 컨셉에 맞게 예쁘게 되어있고, 음식음료 다 맛있다. 특히 애플망고빙수는 아래 씨리얼까지 있어서 더 풍미가 느껴진다 화장실도 깨끗 / 베이글이 너무 먹고싶어서 찾아보다 방문했는데 이게 머선일이죠 너무 맛있어요 고구마 치즈 베이글 강츄 ❤️완전 제스타일 콘베이컨 샌디치도 담백하구 괜춘 하지만 원픽은 고치베 그리고 토마토 스프도 꼭 드세욘 매콤해서 느끼함 싹 잡아줌 쵝오 .. 서울오면 또 올게요오오 잘먹구 갑니당 🐣 / 이름은 베이글하우스지만 제발 수프를 드셔주세요ㅠㅠㅠㅠㅠㅠ 토마토 수프 그냥 토마토 그 자체인데 매콤해서 너무 감칠맛나고 맛있어요 그리고 크림치즈 진짜 안달고 너무 꾸덕하고 미쳤습니다 진짜 그동안 달아빠진 크림치즈를 먹은 제가 너무 불쌍해요 매장도 넓고 자리도 편하고 쾌적해요 근데 진짜 토마토 수프를 드셔주세요 ****토마토 수프**** 괜히 평일쿠폰으로 수프를 주시는게 아니에요 ********토마토수프******** / 2번째 방문이에요!! 전에 먹구 너무 맛있어서 또왔어요>< 아직 다 도전해보진 않았지만 블루베리랑 황치즈가 정말 맛있는거같아요  스프도 생각치못했는데 조합도 좋구 꽤 맛있었어요 담엔 토마토스프 도전하러 또올게요! / 바질 베이글 + 바질 크림치즈 추천하고,, 통밀 베이글 with 토마토숲 진짜 꼭 드세요 ... 너무너무너무너무너무너무 맛있습니다ㅜㅜ 너무 달고 짠 빵에 점령당한 코리아.. 너무 맛있어요 ! 그치만 난 자극이 필요하다! 하시는 분들 토마토숲 약간 스파이시하다는 것🌶️😘❤️ so much i love it everything 🌷 / 평일 오전에 방문했어요!  토마토 수프 진짜 맛있어요 ㅎㅎㅎ매콤하고 새콤해서 느끼할 수 있는 부분들을 싹 잡아줘요! 굿굿  베이글 맛있어요~~ 공간이 넓어서 여유롭고 2층 초록뷰가 이쁘네요 ㅎㅎ / 치즈러버로서 고구마 치즈 베이글과 황치즈베이글, 그리고 느끼함을 잡아줄 토마토 스프까지 주문해서 먹었습니다!! 요즘 유행인 쫜득한 베이글보다는 기본에 충실한 베이글이어서 추억이 돋았고 다 각자의 맛이 잘 느껴져서 생각한 맛 그대로였습니다! 여러분 근데 스프가 찐이에요… 토마토랑 양송이 스프 2종류가 있는데 제가 먹은 토마토 스프는 매콤한게 물리는걸 잡아주더라구요! 다음에는 양송이 스프랑 베이글 샌드위치 도전해볼 예정입니다! / 신촌 명물거리에 생긴 베이글 카페로 저번달인가 생긴것 같더라구요. 수원에서 유명한 곳 같았습니다. 베이글 종류도 다양하게 있고 1층과 2층까지 자리들이 있어서 넓은 편이었습니다. 베이글이 있는 쪽에 인테리어도 예뻤고, 시그니쳐인 단밤도 맛있게 먹었습니다. 외국인들도 많이 오시는것 같았어요. / 빵순이 셋이 나들이 나와서 왔어요ㅎㅎ신촌역에 냅다 내려서 찾아온 곳인데 정말 잘 먹었습니다💕 기대 이상으로 재료가 신선하고 풍성해요 음료도 자두에이드와 딸기라떼 모두 맛이 진해서 좋았어요 인테리어도 예쁘고 깔끔해요! 또 오고 싶은 맛집을 찾았습니다😋❤",디저트가 맛있어요,인테리어가 멋져요,커피가 맛있어요
한술식당 신촌점,,한식,,"맛있어 보이는 게 많아 고심하다가 우삼겹덮밥과 고추장삼겹살덮밥 시켰습니다. 일단 너어어어무 맛있고요 음식 나오자마자 풍기는 고기향과 밥향에 정신이 혼미하네요..♥️🍚 수란 터트려서 먹으면 고소하니 짱이구요, 양배추 절임 적절하니 아삭아삭 맛나요,,🥹 신촌 맛집 하나 저장하고 갑니다. 든든한 한 끼 감사합니다:) / 곱창덮밥이랑 고추장삼겹살덮밥 먹었어요! 가성비가 진짜 좋은 거 같아요! 가격이 착한데 양이 많고 고기가 지이이ㅣ인짜 많아요 사이드로 고로케 먹었는데 자색고구마 고로케가 진짜 맛도리에오.. 처음 먹어보는 맛인데 진짜 맛있어요!!!! / 곱창 치즈 덮밥에 치즈 하나 더 추가했는데 짱 꾸덕하고 맛나용ㅜㅠ 친구가 시킨 마라 곱창덮밥도 마라향이 강해서 좋더라구용☺️❤️ 그리고 다른 친구는 간장삼겹덮밥 시켰는데 넘 맛있다구 울 셋중에 젤 빨리 먹었어요🤣🤣  양은 생각보다 많아서 먹어도 줄지 않네요👍👍 / 제가 먹은 덮밥집 중에 제일 양많고 맛있었어요!! 치즈닭갈비 덮밥은 맵긴한데 맛있게 매워요 ㅎㅎ 곱창 덮밥에는 넓적당면까지 들어가 있어서 더 쫄깃쫄깃하고 맛있었어용!! 매울때쯤 먹어줬던 치킨가라아게도 입에서 살살 녹아요..👍 완전 가격도 저렴해서 가성비맛집이에요!! / 매콤한 소스에 씹는 맛이 있는 당면과 마늘 후레이크 그리고 잘 지은 쌀밥이 예술 정갈한 한상 차림이라 저렴한 가격대인데도 대접 받는 느낌 양이 정말 많아서 어지간히 양 많는 사람들에게도 벅찰 것 같음 / 친구와 점심먹으러 방문했어요! 한식이 먹고싶어서 갔는데 다양한 덮밥 메뉴가 있어서 좋았어요^^ 곱창덮밥과 치즈닭갈비 덮밥 주문했어요~ 곱창이 쫄깃하고 맛나네요! 당면과 야채도 많이들어있어서 좋고 많이 맵지않아서 맵찔이인 저도 맛있게 잘먹었어요^^ 치즈닭갈비 덮밥도 고기가 부드럽고 양념이 적당하게 매콤하고 맛있었어요 ㅋ 모두 국내산 야채와 신동진쌀을 이용해 맛도 건강도 다 챙길수 좋으네요 👍🏻 👍🏻 덮밥 안에 들어있는 갈릭후레이크가 바삭하고 마늘향이 나서 독특하고 맛나요^^ 사이드메뉴인 반반고로케도 감자와 고구마 고로케 반반씩 맛볼수 있어서 좋았고 매콤한 덮밥에 곁들여 먹기딱이네요^^ 신촌맛집으로 추천합니다! / 친구랑 신촌 온 김에 호다닥 검색해서 왔는데 역에서 너무 멀지도 않고 맛있었어여! 가격도 양이랑 맛에 비해서 완전 가성비이고 직원분들도 친절하고 센스 넘치세요! 제가 흰 옷 입었는데 말 안해도 앞치마도 가져다 주셨어요 ㅎㅎㅎ 다음에 신촌 오면 또 갈거 같아요!😍 / 신촌에서 든든한 점심식사 할 수 있는 곳을 찾다가 방문했습니다! 우삼겹 덮밥은 고기도 질기지 않고 간장 소스도 짜지 않아서 너무 맛있게 먹었어요👍 마라곱창 덮밥은 마라의 얼얼한 맛이 강해서 매운것 좋아하시는 분들에게 추천하고 싶습니당 / 사장님 직원분 엄청 친절하십니다. 엄마랑 방문해서 간장삼겹덮밥이랑 원조곱창덮밥 주문했어요~간장삼겹덮밥 맛있어요!!밥 부족하면 서비스로 더 주신다고합니다~양이 어마어마해서 저는 남겼어요~ 가성비짱~맛집 인정!! / 신촌 대학생들의 속을 든든하게 채워주는 맛집, 한술식당 신촌점 다녀왔습니다. 덮밥 전문점이라 바로 베스트 메뉴 두개시켰는데 엄청 푸짐한거있죠?? 왜 재방문율이 높은 맛집인지 한번에 알 수 있었습니다. 이 가격에 사장님 괜찮으신지 모르겠지만 학생들을 위해 영업해주시는 마음 감동적이었습니다!",음식이 맛있어요,양이 많아요,혼밥하기 좋아요
